{"court":"臺灣高等法院","date":"2018-12-12T00:00:00+08:00","no":"105,勞上,53","sys":"民事","reason":"損害賠償","judgement":"臺灣高等法院民事判決　　　　　　　　 105年度勞上字第53號\r\n上　訴　人　高柏科技有限公司\r\n\r\n法定代理人　蕭酩献　\r\n\r\n訴訟代理人　黃淑敏　\r\n　　　　　　蕭瑟芬　\r\n　　　　　　黃立心律師\r\n　　　　　　蔡岳龍律師\r\n　　　　　　陳姵君律師\r\n上　一　人\r\n複　代理人　柯晨晧律師\r\n　　　　　　陳瑞斌律師\r\n被　上訴人　艾美材料科技有限公司\r\n\r\n法定代理人　饒瑞祥　\r\n訴訟代理人　張寧洲律師\r\n被　上訴人　李維鋐　\r\n\r\n\r\n　　　　　　蔡建宏　\r\n　　　　　　饒瑞鈞　\r\n　　　　　　王苡倫　\r\n上五人共同\r\n訴訟代理人　蔡調彰律師\r\n上列當事人間請求損害賠償事件，上訴人對於中華民國105年2月\r\n19日臺灣臺北地方法院101年度重勞訴字第19 號第一審判決提起\r\n上訴，本院於107年10月31日言詞辯論終結，判決如下：\r\n    主  文\r\n原判決關於駁回上訴人後開第二項之訴部分，及該部分假執行之\r\n聲請，暨訴訟費用（確定部分除外）之裁判均廢棄。\r\n被上訴人艾美材料科技有限公司、李維鋐、蔡建宏、饒瑞鈞應連\r\n帶給付上訴人新臺幣肆佰伍拾萬元，及艾美材料科技有限公司、\r\n李維鋐自民國一０一年四月十一日起，蔡建宏、饒瑞鈞自民國一\r\n０一年四月二十四日起，均至清償日止，按週年利率百分之五計\r\n算之利息。\r\n其餘上訴駁回。\r\n第一審（確定部分除外）、第二審訴訟費用，由被上訴人艾美材\r\n料科技有限公司、李維鋐、蔡建宏、饒瑞鈞連帶負擔百分之七，\r\n餘由上訴人負擔。\r\n本判決所命給付部分，於上訴人以新臺幣壹佰伍拾萬元供擔保後\r\n得假執行，但被上訴人艾美材料科技有限公司、李維鋐、蔡建宏\r\n、饒瑞鈞如以新臺幣肆佰伍拾萬元或同額之國泰世華商業銀行西\r\n松分行可轉讓定期存單預供擔保，得免為假執行。\r\n    事實及理由\r\n一、上訴人主張：伊公司係於民國92年間設立，經營導熱介面材\r\n    料之研發及銷售等項目。被上訴人蔡建宏、饒瑞鈞、王苡倫\r\n    （下各以姓名稱之）原均為伊公司員工，依約於任職期間及\r\n    離職後2 年內均負有競業禁止、保密義務。饒瑞鈞及蔡建宏\r\n    於任職期間更擔任不同業務單位最高主管，亦負有公司負責\r\n    人之忠實義務、善良管理人義務及經理人競業禁止義務。渠\r\n    等3 人竟覬覦伊公司商機，於尚在職之98年11月間，即與前\r\n    已於93、94年間自伊公司離職之被上訴人李維鋐（下稱為李\r\n    維鋐）共同投資成立被上訴人艾美材料科技有限公司（下稱\r\n    為艾美公司），嗣並以饒瑞鈞之兄長饒瑞祥、蔡建宏之妹妹\r\n    蔡雅菁、王苡倫之胞弟王令威名義登記為艾美公司股東，經\r\n    營與伊公司相同之營業項目。蔡建宏、王苡倫及饒瑞鈞於99\r\n    年間先後自伊公司離職後，更分別在艾美公司任職或提供服\r\n    務，且將渠等於伊公司任職期間所取得之樣品盒、型錄、產\r\n    品測試報告及贈品予以侵占，於離職後攜往艾美公司繼續使\r\n    用，作為渠等誤導客戶使用。蔡建宏另配合於艾美公司網站\r\n    上偽稱艾美公司早於87年成立工廠、於98年成立業務部云云\r\n    ，以取信客戶。饒瑞鈞甚至早於伊公司任職期間之99年5、6\r\n    月間，即以伊公司員工身分向友達光電科技股份有限公司（\r\n    下稱為友達公司）研發工程師林俊良謊稱伊公司已停產友達\r\n    公司所需產品Li98導熱膠帶，且該膠帶本即為艾美公司生產\r\n    ，可直接向艾美公司採購云云。林俊良因而向友達公司推薦\r\n    艾美公司，艾美公司則派由其時已自伊公司離職之蔡建宏與\r\n    友達公司接洽，友達公司因而改與艾美公司合作。饒瑞鈞復\r\n    曾代表伊公司與友達公司採購人員劉暐辰接觸，卻攔阻劉暐\r\n    辰與伊公司負責人聯繫，反引介艾美公司，且誆稱伊公司材\r\n    料係向艾美公司購買，及伊公司絕不會降價云云，友達公司\r\n    因此導入艾美公司為採購對象，艾美公司亦派由蔡建宏出面\r\n    接洽業務。饒瑞鈞更將伊公司與客戶東貝光電科技股份有限\r\n    公司（下稱為東貝公司）歷經業務接洽、送交型錄、試模等\r\n    程序耗時半年有餘，且經第一次量產後之客製化散熱背膠產\r\n    品規格洩露移轉予艾美公司，由艾美公司向東貝公司報價成\r\n    交，再由已離職之蔡建宏及王苡倫負責後續艾美公司接單作\r\n    業。另饒瑞鈞就其所負責瑞儀光電股份有限公司（下稱為瑞\r\n    儀公司），亦同有將伊公司為瑞儀公司客製化產品規格及單\r\n    價洩露予艾美公司，再由蔡建宏與王苡倫負責艾美公司後續\r\n    接單作業之情形。饒瑞鈞自伊公司離職後，更於100 年3、4\r\n    月間至友達公司台中廠供應商規格說明會大肆發放名片，為\r\n    艾美公司招攬客戶；且向友達集團及冠捷集團等客戶聲稱任\r\n    職於艾美公司，該公司所售產品與伊公司品質相同但價格更\r\n    為低廉云云，將客戶引介至艾美公司。饒瑞鈞復於同年4、5\r\n    月間得知友達公司台中廠巫江昌有新案件擬與伊公司聯繫，\r\n    竟與蔡建宏主動聯絡巫江昌，誆稱艾美公司為伊公司之子公\r\n    司，可直接向艾美公司洽談訂單，致巫江昌誤信其言改向艾\r\n    美公司下單。艾美公司則在蔡建宏、王苡倫離職員工協助下\r\n    ，仿製伊公司型錄以利業務推廣。而李維鋐乃艾美公司實際\r\n    負責人，其除利用蔡建宏、饒瑞鈞及王苡倫知悉及提供之營\r\n    業資料及上開行為，共同以低價侵搶原屬伊公司之市場及締\r\n    約機會以進行不公平競爭外，尚於100年7月18日以電子郵件\r\n    傳送下游廠商張銘利等18人，並指：伊公司為不肖廠商，以\r\n    黑函抹黑艾美公司云云，損害伊公司之信譽。上情堪認饒瑞\r\n    鈞、蔡建宏及王苡倫已違反渠等所簽署僱傭契約所約定保密\r\n    及競業禁止義務，饒瑞鈞及蔡建宏另違反公司法第8 條規定\r\n    公司負責人忠實義務、善良管理人義務及經理人之競業禁止\r\n    義務；渠等均應依系爭契約第8 條及民法第226條、第227條\r\n    之規定對伊負債務不履行損害賠償責任，蔡建宏及饒瑞鈞尚\r\n    應依公司法第23條第1項及第34 條負損害賠償責任。蔡建宏\r\n    、王苡倫、李維鋐及饒瑞鈞所為另已構成民法第184條、第1\r\n    85條之共同侵權行為，艾美公司則應負民法第28 條、第188\r\n    條之連帶賠償責任。又伊公司因被上訴人上揭行為造成100\r\n    年1月至7月之銷貨金額較前年度大幅衰退新臺幣（下同）67\r\n    09萬3074元，自應由被上訴人連帶賠償。惟如鈞院認為上開\r\n    計算方式尚有疑義，亦應以伊公司原有客戶因被上訴人行為\r\n    轉向艾美公司購買導熱介面材料之成交金額計1億6523萬556\r\n    0 元，並按財政部稅務行業標準分類暨同業利潤標準中分類\r\n    編號1841-11 合成樹脂製造乙類淨利率為16％，計算伊公司\r\n    所失利益為2643萬7690元。再加計伊尚有研發產品、開發市\r\n    場、驗證時間成本損失，則伊請求賠償6709萬3074元，自有\r\n    理由等語。並於原審聲明求為：被上訴人應連帶給付上訴人\r\n    6709萬3074元，及自起訴狀繕本送達翌日起至清償日止按週\r\n    年利率5 ％計算之利息；及願供擔保，請准宣告為假執行。\r\n    【原審就上訴人前開請求判決全部敗訴。上訴人先一部聲明\r\n    不服上訴，嗣擴張上訴聲明對原審該部分判決全部不服（本\r\n    院卷(二)第4 頁背面）】。上訴聲明：(一)原判決廢棄。(二)被上\r\n    訴人應連帶給付上訴人6709萬3074元，及自起訴狀繕本送達\r\n    翌日起至清償日止按週年利率5 ％計算之利息。(三)願供擔保\r\n    ，請准宣告為假執行。【上訴人於原審另訴請原審共同被告\r\n    江貞穎、蕭茜文、蔡文傑、林佳臻、蕭錦城連帶賠償部分，\r\n    業經原審判決敗訴，未據聲明不服，非本院審理範圍，於茲\r\n    不贅】。\r\n二、被上訴人則以：艾美公司與上訴人均為電子材料經銷商，同\r\n    業之商業行為，與民法侵權行為無涉。且李維鋐雖於93年11\r\n    月19日至94年1月17日曾任職上訴人，然前後僅2個月，離職\r\n    後即轉任其他行業。至於饒瑞鈞、蔡建宏、王苡倫雖先後於\r\n    99年間自上訴人公司離職，然於任職上訴人期間及離職後，\r\n    從未將上訴人之營業秘密移轉至艾美公司，饒瑞鈞於離職後\r\n    更未曾任職艾美公司。實則上訴人99年度之營業收入猶高於\r\n    饒瑞鈞、蔡建宏及王苡倫尚任職上訴人公司之98年度，益證\r\n    上訴人銷售金額起落應係受經濟景氣循環影響，亦可能係因\r\n    生產結構變化，與艾美公司製造同類型之產品無關。況上訴\r\n    人計算損害，竟未扣除成本，亦不符情理；其業績下降，實\r\n    屬純粹經濟上損失，不能依侵權行為求償。再者，饒瑞鈞、\r\n    蔡建宏於任職上訴人期間並非公司法第29條之經理人。且蔡\r\n    建宏、饒瑞鈞、王苡倫雖與上訴人簽署競業禁止及保密約定\r\n    ，惟上訴人並未對伊等因此限制所生損害給予合理補償，被\r\n    上訴人之工作內容，復涉及上訴人之營業機密，所簽署競業\r\n    禁止及保密約定均應無效。從而上訴人本於侵權行為、債務\r\n    不履行及公司法等規定訴請伊等連帶賠償，均乏所據等語，\r\n    資為抗辯。答辯聲明：(一)上訴駁回。(二)如受不利判決，願以\r\n    現金或同額之國泰世華商業銀行西松分行可轉讓定期存單供\r\n    擔保，請准為免假執行之宣告。\r\n三、查蔡建宏、饒瑞鈞、王苡倫、李維鋐均為上訴人前任員工；\r\n    其中蔡建宏自93年1月15日起至99年2月止、饒瑞鈞自93年12\r\n    月28日起至99年12月止，均在上訴人擔任業務主任，王苡倫\r\n    自96年9月17日起至99年3月止，在上訴人擔任業務助理，李\r\n    維鋐則於93年間在上訴人擔任業務人員。且蔡建宏、饒瑞鈞\r\n    、王苡倫於任職上訴人期間均與上訴人簽訂有員工聘僱暨保\r\n    密合約書。又艾美公司係於98年11月10日成立，經營之主要\r\n    業務項目為導熱介面材料之研發與銷售，登記所營事業為工\r\n    業助劑批發業、化學原料批發業及電子材料批發業，均與上\r\n    訴人相同。且艾美公司設立時之股東為李維鋐、饒瑞鈞、蔡\r\n    建宏與訴外人鄭國榮。嗣股東變更為李維鋐、饒瑞祥、蔡雅\r\n    菁及王令威；其中饒瑞祥為饒瑞鈞之兄長、蔡雅菁為蔡建宏\r\n    之妹妹，王令威則為王苡倫之胞弟。另臺灣臺北地方法院10\r\n    1年度司執全字第4號假扣押強制執行事件至艾美公司實施假\r\n    扣押時，並曾查扣有上訴人公司型錄、產品、樣品盒、贈品\r\n    ，及美國電子材料協會測試規範各節，為兩造所不爭執（原\r\n    審重勞訴卷(八)第52頁正、背面）。且有公司基本資料查詢明\r\n    細、各類所得扣繳暨免扣繳憑單、勞工保險被保險人投保資\r\n    料表、艾美公司變更登記表、人事資料表、戶籍謄本、饒瑞\r\n    鈞及李維鋐及蔡建宏艾美公司名片、僱傭契約、員工聘僱暨\r\n    保密合約、員工保證書可稽（原審司北勞調卷第36頁至第47\r\n    頁、第52頁至第55頁、第59頁至第61頁、第63頁、第66頁、\r\n    第68頁至第71頁、第76頁至第78頁、第151頁至第158頁、第\r\n    170頁、第171頁、第188頁、第189頁，原審重勞訴卷(一)第26\r\n    頁至第33頁、第45頁至第53頁），應與事實相符。\r\n四、又上訴人主張：蔡建宏、饒瑞鈞及王苡倫於任職伊公司期間\r\n    ，即與李維鋐共同成立艾美公司以進行同業競爭，已違反僱\r\n    傭契約及忠誠義務，應依侵權行為、債務不履行及公司法等\r\n    規定，就伊公司所受損害負賠償責任等語，為被上訴人否認\r\n    ，並以前詞置辯。茲查：\r\n  (一)蔡建宏、饒瑞鈞及王苡倫與上訴人所簽署僱傭契約第10條約\r\n    定：「乙方於受聘期間內所獲得甲方及其客戶有關之活動、\r\n    商業作業或任何其他資料，皆係甲方及（或）客戶之營業秘\r\n    密及智慧財產。乙方茲同意：於本契約有效期間及終止後皆\r\n    隨時對該等資料保密，不得對新聞體、政府機關或任何第三\r\n    者以任何理由揭露該等資料」；第11條約定：「乙方於受聘\r\n    期間不得對其他第三人（包括公司及客人）提供特定工作或\r\n    類似之服務，且非經甲方書面同意，不得受僱或提供任何服\r\n    務於其他機構或從事相關服務」；第12條約定：「乙方於受\r\n    聘期間須遵守下列各款：1.不得利用職務上之便利所取得之\r\n    資料，由本人或提供第三者從事蒐集、電腦處理、國際傳遞\r\n    或利用等行為。2.不對客戶就本公司相關業務作不實或逾越\r\n    權限之說明或承諾，致使甲方聲譽與權利受損。3.不得偽造\r\n    不實資料給客戶及廠商，或與客戶及廠商勾結填寫不實資料\r\n    致使甲方權益遭受損失。4......」；第14條約定：「...。\r\n    且非經公司之允許，在離職兩年內不得從事與本公司相同或\r\n    類似性質的工作，從事為自己或第三人經營與其所辦理之同\r\n    類事業，亦不得同類事業無限責任之股東」；第18條第2 項\r\n    約定：「乙方所獲悉甲方關於營業上、技術上之秘密，不得\r\n    洩漏，退職後亦同」等語，有各該僱傭契約影本可稽（原審\r\n    司北勞調卷第151 頁至第153頁、第157頁、第158頁、第170\r\n    頁、第171 頁，原審重勞訴卷(一)第26頁至第28頁、第32頁、\r\n    第33頁、第45頁、第46頁）。蔡建宏另簽署之員工聘僱及保\r\n    密合約約定：「4.1 乙方同意採取必要措施維護其於受聘期\r\n    間，所知悉或持有之營業秘密及企業機密，除職務上之正常\r\n    使用外，非經甲方事前書面同意，不得洩漏、告知、交付或\r\n    以任何其他方式移轉予任何第三人，或對外發展，或為自己\r\n    或第三人使用、利用」、「5.受聘期間之競業禁止：乙方同\r\n    意於受聘期間，非經甲方書面同意，不得有下列行為：5.1\r\n    以自己或他人名義經營與甲方相同或相似產品類之事業。…\r\n    …6.文件所有權：6.1 乙方受有機密物品、文件之交付者，\r\n    應盡善良管理人之注意保管義務。6.2 所有記載或含有營業\r\n    秘密或企業機密之文件、資料、報告、圖表、資訊或其他媒\r\n    體之所有權，皆歸甲方所有，乙方於聘約關係終止時或經甲\r\n    方請求時，應立即交予甲方，或甲方指定之人員，並辦妥相\r\n    關交接手續。……8.違約罰則：乙方違反本約各項約定時，\r\n    甲方除得終止雙方聘用合約外，乙方並應賠償甲方所受損害\r\n    及負擔洩漏秘密之刑事責任」等語，亦有各該合約影本足稽\r\n    （原審司北勞調卷第第154頁、155頁，原審重勞訴卷(一)第29\r\n    頁、第30頁）。蔡建宏簽署之員工保證書則約定：「1.對公\r\n    司之業務、客戶往來及管理、技術等資料，應嚴守機密，不\r\n    得洩露（若屬實並予以開除、追究相關民、刑事責任）。2.\r\n    不得藉職務之便利，營私舞弊，收受餽贈，圖謀私利，在外\r\n    招搖撞騙，侵用公款或利用，亦不得有濫用職權行為（若屬\r\n    實並予以開除）。... 6.員工不得洩露相關知悉之業務資料\r\n    ，即使離職亦不可將所知業務資料告知或洩露他人若違反並\r\n    查證實，追究相關民、刑事責任」等語，有員工保證書影本\r\n    存卷為據（原審司北勞調卷第156 頁，原審重勞訴卷(一)第31\r\n    頁），均堪信為真實。\r\n  (二)次查蔡建宏、饒瑞鈞及王苡倫均否認於任職上訴人期間有為\r\n    艾美公司提供特定工作或類似之服務之情事，饒瑞鈞並否認\r\n    於離職後曾任職艾美公司或從事與上訴人相同或類似性之工\r\n    作。至於蔡建宏、王苡倫雖自承自上訴人離職後即任職於艾\r\n    美公司，惟渠等與饒瑞鈞均否認曾將任職上訴人期間所獲取\r\n    得上訴人及其客戶有關之活動、商業作業或任何其他資料，\r\n    提供予艾美公司，亦否認於任職期間有持有任何上訴人營業\r\n    秘密等資訊；且均抗辯：上開競業禁止約款未約定合理之補\r\n    償，應屬無效，伊等自未違約，亦未有不法侵權行為云云。\r\n    然查：\r\n  1.按競業禁止之約定，乃僱主為免受僱人於任職期間所獲得其\r\n    營業上之秘密或與其商業利益有關之隱密資訊，遭受受僱人\r\n    以不當方式揭露在外，造成僱主益受損，而與受僱人約定在\r\n    任職期間及離職一定期間內，不得利用於原僱主服務期間所\r\n    知悉之技術或業務資訊為競業之行為。而關於離職後之約定\r\n    ，其限制之時間、地區、範圍及方式，在社會一般觀念及商\r\n    業習慣上，可認為合理適當且不危及受限制當事人之經濟生\r\n    存能力，其約定始非無效（最高法院103年台上字第793號判\r\n    決意旨參照）。經查饒瑞鈞、蔡建宏及王苡倫與上訴人所簽\r\n    署前揭契約條款中，有關渠等於離職後2 年內不得從事與本\r\n    公司相同或類似性質的工作，從事為自己或第三人經營與其\r\n    所辦理之同類事業，亦不得同類事業無限責任之股東等離職\r\n    後競業禁止之約定，並未對於渠等因此項限制所生之損害約\r\n    定合理之補償，依前揭說明，自應認為無效。上訴人主張：\r\n    因上開條款未約定被上訴人違反義務時應給付損害賠償金額\r\n    ，故可認為有效云云，顯對上開應付合理補償之目的乃在補\r\n    償受僱人工作權受限之目的所有誤解，不足採取。惟上開契\r\n    約條款中關於渠等於受聘期間不得利用職務上之便利所取得\r\n    之資料，由本人或提供第三者從事蒐集、電腦處理、國際傳\r\n    遞或利用等行為；不對客戶就本公司相關業務作不實或逾越\r\n    權限之說明或承諾，致使甲方聲譽與權利受損；不得偽造不\r\n    實資料給客戶及廠商，或與客戶及廠商勾結填寫不實資料致\r\n    使甲方權益遭受損失等約定，既屬在職期間之競業禁止，已\r\n    提供服務期間之薪資為對價，且屬受僱人依勞僱契約所應盡\r\n    之忠誠義務，其所為限制，自屬合法有效。又按故意以背於\r\n    善良風俗之方法，加損害於他人者，負損害賠償責任，民法\r\n    第184條第1項後段定有明文。所謂背於善良風俗，在現代多\r\n    元及工商發達之社會，不僅指行為違反倫理道德、社會習俗\r\n    及價值意識，並包括以悖離於經濟競爭秩序與商業倫理之不\r\n    正當行為，惡性榨取他方努力之成果在內。如企業員工於企\r\n    業經營或商業活動中，利用職務機會取得企業之資源，合謀\r\n    與該企業為不正當之營業競爭，致使企業流失其原有之客戶\r\n    ，而遭受損害者，亦屬之（最高法院106年度台上字第1693\r\n    號判決意旨參照）。是蔡建宏、饒瑞鈞及王苡倫於任職上訴\r\n    人期間，倘有另為他人從事或提供相類服務；或於離職前後\r\n    ，果有利用職務機會取得企業之資源，合謀與該企業為不正\r\n    當之營業競爭，致上訴人受有損害者，仍應負債務不履行及\r\n    侵權行為之損害賠償責任，其理至明。\r\n  2.上訴人主張：蔡建宏、饒瑞鈞原均任職伊公司業務主任，乃\r\n    業務單位之最高主管，實質為公司經理人。渠2 人於伊公司\r\n    任職期間，即與李維鋐共同出資設立與伊公司經營相同業務\r\n    之艾美公司，且饒瑞鈞、蔡建宏均為98年11月10日艾美公司\r\n    設立時之原始股東，饒瑞鈞登記出資額為全部股東中最高即\r\n    60萬元，蔡建宏亦有25萬元等情，有上訴人公司組織圖、公\r\n    告、艾美公司設立登記表及章程可稽（原審重勞訴卷(二)第11\r\n    1頁、第112頁，原審重勞訴卷(八)第252頁、第253頁）。且於\r\n    艾美公司設立時登記為董事長之鄭國榮已於蔡建宏、饒瑞鈞\r\n    被訴背信之刑事案件（下稱刑案）偵查中陳明：伊僅受李維\r\n    鋐請託掛名為艾美公司負責人股東等語（筆錄附於臺灣桃園\r\n    地方法院檢察署100年度他字第3125 號卷〈下稱為桃檢他卷\r\n    〉第129 頁）。李維鋐亦自承：伊為艾美公司實際負責人，\r\n    艾美公司是伊成立的等語（筆錄附於桃檢他卷第175 頁）。\r\n    饒瑞鈞及蔡建宏於刑案偵查中更均自承知悉投資艾美公司乃\r\n    不被允許等語（筆錄附於臺灣桃園地方法院檢察署101 年度\r\n    偵續字第157號卷〈下稱為桃檢偵續卷〉第140 頁、第144頁\r\n    ；臺灣桃園地方法院檢察署102年度偵續一字第19 號卷〈下\r\n    稱為桃檢偵續一卷〉第72頁；筆錄影本附於原審重勞訴卷(八)\r\n    第23頁、第27頁）。堪認上訴人質疑蔡建宏及饒瑞鈞已違反\r\n    前揭在職期間之競業禁止約定及僱傭關係之忠誠義務乙節，\r\n    確非無稽。饒瑞鈞雖另抗辯：伊知道不能做投資艾美公司的\r\n    事，後來就把股份轉給伊兄長等語，有桃檢偵續卷101年8月\r\n    3 日訊問筆錄可稽（影本附原審重勞訴卷(八)第23頁）；蔡建\r\n    宏亦辯以：伊確於98年11月10日登記為艾美公司原始股東，\r\n    伊係用家人的錢來投資，後來覺得不行，就在99年1 月間變\r\n    更為伊母親李麗如名義，伊母去世後則變更登記為伊胞妹蔡\r\n    雅菁名義等語（筆錄影本附於原審重勞訴卷(八)第27頁），且\r\n    提出艾美公司變更登記表影本為證（原審重勞訴卷(一)第47頁\r\n    、第48頁，原審重勞訴卷(八)第254 頁正、背面；桃檢偵續卷\r\n    第106頁、第108頁）。惟審酌蔡建宏及饒瑞鈞於任職上訴人\r\n    期間，即與李維鋐共同出資設立同業競爭之艾美公司公司，\r\n    嗣雖移轉股權，然受移轉者亦為渠等之至親等情，既為渠等\r\n    所不爭執（原審重勞訴卷(八)第23頁、第26頁、第28頁），且\r\n    有上訴人公司人事資料表及戶籍謄本等件（均影本）可佐（\r\n    原審重勞訴卷(一)第51頁、第52頁）。足見渠等於變更登記後\r\n    ，仍與艾美公司股份登記名義人間關係密切，非無借名之嫌\r\n    。且饒瑞鈞及蔡建宏雖抗辯：上開資金乃渠等家人提供，嗣\r\n    亦僅單純介紹家人投資云云。另依刑案偵查中查調之稅務電\r\n    子閘門財產所得調件明細表亦見艾美公司之投資及薪資所得\r\n    乃列在饒瑞祥及蔡雅菁名下，有該等明細表附於刑案卷內可\r\n    憑（桃檢偵續卷第78頁、第79頁、第82頁、第86頁、第87頁\r\n    ）。然審酌蔡建宏於100年9月10日因刑案接受警方調查時，\r\n    竟全然否認在艾美公司任職，且推稱不認識艾美公司之董事\r\n    或股東，亦不清楚艾美公司與友達公司有無往來云云（臺灣\r\n    臺北地方法院檢察署100年度他字第7499 號卷〈下稱為北檢\r\n    他卷〉第32頁），已見情虛。且關於艾美公司於100年7月間\r\n    增資2500萬元後，饒瑞祥之出資額達1650萬元，蔡雅菁之出\r\n    資額亦有660萬元，已達全部出資額3000萬元之7成以上，有\r\n    艾美公司變更登記表可稽（桃檢偵續卷第114 頁）。另依艾\r\n    美公司增加資本股東繳納現金股款明細表（附於桃檢偵續一\r\n    卷第300頁）所示，該筆2500萬元款項於100年7 月22日經提\r\n    領後，即由饒瑞鈞於同日將其中900 萬匯予其妻張韻梅（參\r\n    桃檢偵續卷第40 頁饒瑞鈞戶籍謄本）、將其中195萬元匯予\r\n    其本人、其中35 萬元匯予王苡倫、其中780萬元匯予訴外人\r\n    張陳曉莉等情，亦有匯款申請書影本4 紙附於刑案偵查卷內\r\n    可佐（桃檢偵續一卷第303頁至第306頁）。則以上開各節，\r\n    併酌以艾美公司增資資金竟由饒瑞鈞操作匯款，其中更有逾\r\n    千萬元轉回其個人及其配偶之情，益見蔡建宏及饒瑞鈞早自\r\n    尚在上訴人公司任職期間，即已實際涉入艾美公司之經營及\r\n    投資，洵無疑義。則上訴人主張：蔡建宏及饒瑞鈞已違反前\r\n    揭僱傭契約約定：「乙方於受聘期間不得對其他第三人（包\r\n    括公司及客人）提供特定工作或類似之服務，且非經甲方書\r\n    面同意，不得受僱或提供任何服務於其他機構或從事相關服\r\n    務」，應負違約賠償責任等語，自非無稽。\r\n  3.次查蔡建宏雖主張；伊於99年2月自高柏公司離職後，迄100\r\n    年10月1 日始任職於艾美公司等語。然亦於刑案偵查中自承\r\n    ：伊自99年4、5月間已開始在艾美公司幫忙找材料來源及接\r\n    洽客戶，一直到99年底，100年4月至9 月則在艾美公司之上\r\n    游捷友公司上班，在艾美公司任職時係負責友達公司部分的\r\n    業務等語（北檢他卷第70頁，桃檢偵續卷第143頁、第243頁\r\n    ）。顯然蔡建宏不僅於上訴人任職期間即與饒瑞鈞、李維鋐\r\n    共同設立與上訴人同業競爭之艾美公司，且於離職後即有為\r\n    艾美公司提供服務，嗣更任職於艾美公司至明。又雖蔡建宏\r\n    於上訴人任職時所簽署前揭契約條款中，關於離職後競業禁\r\n    止約定部分為無效，業經認定。然上訴人主張：蔡建宏於離\r\n    職後即與尚在伊公司任職之饒瑞鈞共謀，推由饒瑞鈞以伊公\r\n    司員工身分向友達公司研發工程師林俊良、採購人員劉暐辰\r\n    為不利於伊公司之不實陳述，且推介友達公司向艾美公司採\r\n    購，再由蔡建宏代表艾美公司與友達公司洽接，以達侵奪伊\r\n    公司交易市場，乃共同以違反善良風俗之方式從事不公平競\r\n    爭，並致伊公司受有客戶流失之損害等語，已援引證人即友\r\n    達公司研發工程師林俊良及採購人員劉暐辰於刑案偵審中之\r\n    證詞為憑。即饒瑞鈞亦於刑案審理時自承：於99年間任職高\r\n    柏公司期間，曾代表高柏公司與友達公司新竹廠區林俊良及\r\n    劉暐辰接洽，且確有為高柏公司送樣品予林俊良測試；亦曾\r\n    於99年6、7月間拜訪友達公司新到任之採購人員劉暐辰進行\r\n    禮貌性拜訪，並於99年7月份進行報價，劉暐辰係於99年7月\r\n    份提出降價要求，伊則表示大幅度的降價要請示老闆等語（\r\n    筆錄附於臺灣桃園地方法院102年度審易字第2697號卷〈下\r\n    稱為桃院審易卷〉第33頁背面、第34頁；臺灣桃園地方法院\r\n    10 3年度易字第49號卷〈下稱為桃院易卷〉(一)第43頁背面至\r\n    第45頁）。又饒瑞鈞雖否認有向林俊良及劉暐辰聲稱上訴人\r\n    將斷料或未據實轉達友達公司降價要求，更否認有以艾美公\r\n    司為原廠及向友達公司推介與艾美公司交易云云。然查：\r\n  ①證人即友達公司研發部門研發工程師林俊良於刑事偵查中證\r\n    稱：伊在友達公司新竹廠區中小尺寸工業控制顯示器部門任\r\n    職，高柏公司是友達公司新竹廠區導熱材料的供應商；在99\r\n    年5、6月時，友達公司研發單位指定要購買Li98導熱膠帶，\r\n    當時高柏公司是唯一供應商，伊就通知高柏公司業務窗口饒\r\n    瑞鈞，請他提供材料給伊先試用，才會寫在材料部件清單（\r\n    下稱為材料清單）上，再由採購依據材料清單去下單，伊要\r\n    試用Li98時有通知饒瑞鈞，且第1次、第2次饒瑞鈞帶來的材\r\n    料是高柏公司的，但第3 次時饒瑞鈞跟伊說高柏公司已經沒\r\n    有提供該材料，他跟伊說LI98導熱膠帶不是高柏公司所生產\r\n    ，高柏公司只是代理商，艾美公司才是Li98原材料的生產供\r\n    應商，高柏公司是向艾美公司採購的，因為材料是一樣的，\r\n    友達公司可以直接向艾美公司購買云云。然因友達公司有標\r\n    準認證程序，而當時艾美公司並非友達公司的合格供應商，\r\n    於是伊就向採購告知高柏公司後續可能無法提供材料；後續\r\n    是由採購單位處理，至於當時清單上還是高柏公司，這是因\r\n    為當時高柏公司還是唯一的供應商等語（筆錄附於北檢他卷\r\n    第83頁至第85頁、第86頁；筆錄影本附於原審重勞訴卷(八)第\r\n    109頁至第110頁）。復於刑案審理時證稱：伊是友達公司的\r\n    研發工程師，負責開發新機種，伊在決定開發新機種所需之\r\n    材料後，會在採購系統上之材料清單選取該材料之購買廠商\r\n    ，但要進入材料清單前，必須先成為友達公司之供應商。伊\r\n    通知饒瑞鈞送樣所開發之新機種編號為G220SW02（桃院易卷\r\n    (一)第141頁第4欄），係在99年4月8日建立新機種，材料清單\r\n    建立高柏公司為供應商，產品開發時有請高柏公司送來Li98\r\n    導熱膠帶作新產品測試，高柏公司有送料3 次，都是饒瑞鈞\r\n    送料，第3 次饒瑞鈞送料時，因為饒瑞鈞對伊稱高柏公司可\r\n    能會斷料，他說高柏公司不會再生產Li98導熱膠帶，此材料\r\n    會由原廠供應，原廠就是艾美公司；因為斷料在產品試產時\r\n    是十分嚴重的事，一旦斷料，新開發之機種生產進度會延遲\r\n    ，進而影響後續產品開發完成及試產後之放量生產，所以伊\r\n    確定饒瑞鈞對伊所稱之詞句為「斷料」。又當初伊不確定高\r\n    柏公司是原材料廠，或真係如饒瑞鈞所稱係原材料廠供貨予\r\n    高柏公司，高柏公司僅係裁切廠，過去發生過原材料廠不願\r\n    意供貨予裁切廠，欲自己進行裁切等情事，伊因而相信饒瑞\r\n    鈞所言上情，並馬上將Li98導熱膠帶可能斷料乙情告知採購\r\n    人員，採購人員稱渠等會再向供應商暸解是否確實會斷料，\r\n    而當時供應商之窗口即為饒瑞鈞。後續就交給採購處理等語\r\n    （筆錄影本附於原審重勞訴卷(八)第80頁至第88頁；筆錄附於\r\n    桃院易卷(二)第15頁背面、第16頁背面、第20頁背面、第21頁\r\n    ）。核確與上訴人指述上情相符。再參以證人劉暐辰於刑案\r\n    偵查中證稱：伊為友達公司採購人員，並自99年5 月14日起\r\n    任職；伊的業務範疇是部材採買，研發單位告訴我們需要什\r\n    麼部材及數量，伊就從現有供應商中去比價選擇廠商，這些\r\n    廠商報價，詢價後由伊這邊決定用哪間廠商的貨，另由下訂\r\n    單的單位向廠商下訂進貨。所以伊的部分主要是在尋找供應\r\n    商與詢價，伊會從現有供應商去找，新的供應商要進入名單\r\n    內，產品要經過研發部門的認證，再評估報價水準，若此供\r\n    應商有潛力，採購部門就可以決定是否納入供應商名單等語\r\n    （筆錄附於北檢他卷第63頁、第64頁；筆錄影本附於原審重\r\n    勞訴卷(六)第190頁至第193頁，原審重勞訴卷(八)第33頁至第35\r\n    頁）。併依友達公司101年4月11號函覆公平交易委員會稱：\r\n    「友達公司導熱介面材料之採購流程，係由研發工程師按照\r\n    產品需求向採購提出新部材使用申請，並由研發工程師提供\r\n    採購其所需要的產品規格，再由採購人員按照研發工程師所\r\n    提供規格向符合公司內部規定之供應商進行詢價，並由提供\r\n    最低價之供應商得標」（影本附於桃院易卷(一)第40頁、第41\r\n    頁；桃院易卷(二)第103頁），有該函附於公平交易卷內可憑\r\n    （公平交易甲卷第350頁；影卷另併卷存放）。可知欲獲得\r\n    與友達公司交易機會，勢須先取得該公司合格供應商資格至\r\n    明。而艾美公司確係於饒瑞鈞前揭不實陳述後之99年6月14\r\n    日經友達公司登錄為合格供應商乙節，則有友達公司103年\r\n    11月21日桃院勤刑育103年49字第1030019213號陳報狀，及\r\n    友達公司104年12月22日民事陳報狀可據（桃院易卷(三)第8頁\r\n    ；原審重勞訴卷(八)第216頁)。堪認上訴人指述：饒瑞鈞與蔡\r\n    建宏於任職伊公司期間共同設立伊公司後，即推由尚任職之\r\n    饒瑞鈞向友達公司研發人員散佈前揭不實言論，且艾美公司\r\n    確因饒瑞鈞以高柏公司非原廠，且即將斷料之不實訊息，始\r\n    經檢驗並於99年6月14日成為友達公司合格供應商，進而取\r\n    得與友達公司及其供應鏈廠商之交易機會等語，確屬有據。\r\n  ②次查證人即友達公司新竹廠採購人員劉暐辰於刑案偵查中證\r\n    稱：饒瑞鈞所屬的高柏公司是我們TV部門（大尺寸）導熱材\r\n    料唯一的供應商，所以詢價後一定會採買，但每一季我們都\r\n    會提出降價要求，不過若沒有降價我們也得選擇。當時友達\r\n    有成本壓力，伊向饒瑞鈞提出降價要求，饒瑞鈞僅願意降價\r\n    3％至5％，因不符公司需求，所以伊必須另外尋找新的供應\r\n    商，當時饒瑞鈞就引薦艾美公司給伊，表示艾美公司是友達\r\n    公司顯示器部門（中尺寸）有在使用的供應商，也有供應大\r\n    尺寸的導熱材料，所以伊就請研發部門針對艾美公司進行驗\r\n    證，當時有驗證通過（按應指產品驗證），所以就直接下單\r\n    。高柏公司原本是友達公司導熱材料唯一供應商，後來就找\r\n    來艾美公司，還有先鋒公司，先鋒公司原本是友達公司其他\r\n    材料的供應商等語（筆錄附於北檢他卷第63頁、第64頁；筆\r\n    錄影本附於原審重勞訴卷(六)第190頁至第193頁，原審重勞訴\r\n    卷(八)第33頁至第35頁）。其復於刑案發回續查時證稱：「..\r\n    ..我們原先跟高柏公司採購，當時饒瑞鈞有跟我們提到艾美\r\n    公司，當時饒瑞鈞是以高柏公司業務的身分，來跟我們公司\r\n    議價，確提到艾美公司的東西比較便宜，後來是艾美公司的\r\n    蔡建宏主動跟我們聯繫的、我也不知道他如何拿到我的名片\r\n    ，後來我們有跟艾美公司詢價，發現他們價格比較低，我們\r\n    有將艾美公司材料給工程師試驗，也沒有問題，後來就跟他\r\n    們採購」、「（艾美公司與高柏公司銷售的東西是否相同？\r\n    ）性質是一樣的。他們做出的產品對我們來說是同一個類型\r\n    」、「（當時是否透過饒瑞鈞要跟高柏公司降價？）有。在\r\n    我們公司每三個月會跟供應商議價一次，當時有跟他們提出\r\n    希望價降，但詳細數字我忘記了，饒瑞鈞回覆我說他們公司\r\n    無法降價。」、「（問：是無降價幅度無法符合你們需求？\r\n    還是無法降價？）我忘記了」等語（筆錄影本附於原審重勞\r\n    訴卷(六)第194頁至第197 頁；筆錄附於桃檢偵續一卷第142頁\r\n    、第143 頁）。亦核與上訴人主張上情一致。再審酌蔡建宏\r\n    雖否認與饒瑞鈞共謀，然亦於刑案偵查中陳稱：伊記得是99\r\n    年底劉暐辰去友達上班，他需要材料的資訊，艾美公司向劉\r\n    暐辰介紹伊對這方面有了解，所以伊帶型錄去友達，向劉暐\r\n    辰介紹、推薦艾美公司的產品，伊推薦的是電視螢幕的材料\r\n    ；目前艾美公司確為友達公司大尺寸、中尺寸導熱材料的供\r\n    應商等語（北檢他卷第70頁、第71頁）。併參以證人即任職\r\n    友達公司臺中區大尺寸膠帶研發部門之巫江昌證稱：就伊負\r\n    責的大尺寸研發部門，一開始友達公司最常用的是高柏公司\r\n    的材料等語（桃院易卷(三)第63頁）。證人即友達公司TV顯示\r\n    器開發部經理熊國佑亦證稱：劉暐辰是機構件的採購人員，\r\n    導熱膠帶及導熱矽膠均由其負責。高柏公司的導熱矽膠部分\r\n    是因為採購人員劉暐辰告知高柏公司之降價幅度不符合採購\r\n    要求，所以才在TV部門亦導入艾美公司及先鋒公司以擴大供\r\n    應鏈等語（桃院易卷(二)第173 頁、第174頁、第175頁背面、\r\n    第176頁）。足認友達公司就TV 部門之導熱矽膠部分所以增\r\n    加艾美公司為採購對象，確與饒瑞鈞向劉暐辰告知高柏公司\r\n    無法配合降幅且推薦向艾美公司採購乙節，息息相關。則上\r\n    訴人主張：饒瑞鈞於任職期間以首揭不實陳述使艾美公司取\r\n    得中尺寸供應商資格後，又利用其於高柏公司任職期間取得\r\n    之客戶友達公司洽接交易之機會，悖於忠誠義務，向高柏公\r\n    司之客戶友達公司推介與高柏公司同業競爭之艾美公司，再\r\n    由其時已任職於艾美公司蔡建宏利用此交易資訊主動代表艾\r\n    美公司與友達公司接洽，進而侵奪高柏公司之交易機會，亦\r\n    非子虛。\r\n  ③蔡建宏及饒瑞鈞雖抗辯：友達公司關於導熱膠帶及導熱矽膠\r\n    之供應商多達數百家，艾美公司亦早在99年5月、6月之前即\r\n    已成為友達公司供應商，上訴人並非唯一。至於林俊良於99\r\n    年5、6月間以饒瑞鈞送樣之Li98導熱膠帶所開發友達新機種\r\n    編號G220SW02之材料清單，早於99年4月8日已建立供應商為\r\n    上訴人，饒瑞鈞自不可能於事後之99年5、6月再向林俊良送\r\n    樣並為不實陳述。況該新機種事後亦未量產；且於此之後，\r\n    友達公司及其下游廠商仍有與上訴人進行交易，然友達公司\r\n    與艾美公司首次交易卻係於100年3月24日，且交易品項為導\r\n    熱矽膠，與導熱膠帶全然無關。上開各節足認饒瑞鈞及蔡建\r\n    宏並無向友達公司林俊良為不實陳述，上訴人亦未因此受到\r\n    損害云云，並引據刑案卷附友達公司函所檢送與高柏公司歷\r\n    年材料部件清單，友達公司103年11月18日友達發字第10311\r\n    19號函、友達公司103年11月21日桃院勤刑育103年49字第10\r\n    30019213號陳報狀為憑(桃院易卷(一)第71頁、第141頁，桃院\r\n    易卷(三)第1頁、第8頁；原審重勞訴卷(八)第114頁）。然查：\r\n  (1)艾美公司確係於99年6 月14日始登記成為友達公司之合格供\r\n    應商乙節，業經認定於前。則被上訴人抗辯，艾美公司早於\r\n    饒瑞鈞於99年5、6月間與林俊良洽接送樣之前，即已取得友\r\n    達公司合格供應商資格云云，洵屬無據。\r\n  (2)又友達公司前揭103年4月10日函文附件雖列舉多數廠商為其\r\n    導熱膠帶及導熱矽膠於98 年至100年間之供應商；然依該公\r\n    司103年11月21日桃院勤刑育103年49字第1030019213號陳報\r\n    狀表示：友達公司未就「導熱膠帶」此品項建立合格供應商\r\n    名冊，友達公司系統上就導熱膠帶之合格供應商品項分類係\r\n    屬於「TAPE」，而此分類於103年間之合格供應商共有331家\r\n    等語（桃院易卷(一)第71頁、第141頁，桃院易卷(三)第1頁、第\r\n    8頁）。可知友達公司前揭103年4 月10日函文所提供供應商\r\n    名單及數量，絕非僅限於「導熱膠帶」及「導熱矽膠」二項\r\n    而已。再依友達公司101年4月11日回覆予公平交易委員會函\r\n    已臚列友達公司於99 年、100年間就散熱背膠及導熱膠帶等\r\n    導熱介面材料之交易相對人為高柏公司、先鋒公司及艾美公\r\n    司，且艾美公司係於99 年、100年度新增之採購對象等語，\r\n    有該函影本附於刑案卷內足稽（桃院易卷(二)第103 頁）。證\r\n    人即友達公司TV顯示器開發部經理熊國佑更證稱：導熱膠帶\r\n    （THERMAL TAPE）原本使用高柏公司產品伊知道，後來改用\r\n    艾美公司產品伊也知道等語（原審重勞訴卷(八)第132 頁背面\r\n    、第139頁；刑案桃院易卷(二)第169頁、第170頁、第171頁背\r\n    面）。可知友達公司首揭103年4月10日函文提供清單應有誤\r\n    解。況依證人即高柏公司負責人蕭酩献於刑案審理時證稱：\r\n    以導熱介面產品來說，在當時確實有其他供應商，但如果依\r\n    照特定客戶要求裁切成特定尺寸，就會成為客戶要求的客製\r\n    化產品；是以如果以Li98導熱膠帶來說，是不會有其他供應\r\n    商，因為這個料號是高柏公司所代表的料號，並可依友達公\r\n    司指示客製化裁切為各種尺寸，這個料號是高柏公司自行生\r\n    產，嚴格來說是高柏公司轉投資之旭立公司生產提供，是由\r\n    高柏公司與旭立公司合作開發；至於友達公司在下單時，有\r\n    可能是友達公司自行下單，也有可能是由友達公司之下游廠\r\n    商下單等語（桃院易卷(二)第4頁正、背面、第6頁）。並參諸\r\n    證人林俊良於刑案審理交互詰問再明確表示：伊擔任工程師\r\n    時會使用到Li98導熱膠帶，當時供應商在伊手上確只有高柏\r\n    公司，伊當時任職是屬於工業用的顯示器，所以導熱膠帶是\r\n    比較特殊規格，這個膠帶原本是在一般監視器使用上，是已\r\n    經認證完成的，Li98是材料名字，當時專指高柏公司有此Li\r\n    98的材料，因為我們建立料號就專指一家供應商，所以Li98\r\n    此料號沒有其他供應商等語（桃院易卷(二)第15頁）。可知證\r\n    人林俊良證述以高柏公司為唯一供應商乙節，乃在指特定之\r\n    Li98導熱膠帶至明；其所為證言核與友達公司前揭函文提供\r\n    之供應商名單，實並無矛盾。且審酌饒瑞鈞係以高柏公司所\r\n    提供Li98導熱膠帶即將斷料為由，向林俊良誆稱可直接由原\r\n    廠艾美公司訂購云云，已如前述。友達公司並函覆係為增加\r\n    供應鍊健全度，故而增加艾美公司為採購對象等語，亦有該\r\n    公司104年4月11日函可憑（影本附於桃院易卷(二)第103 頁）\r\n    。證人熊國佑更證稱：要成為友達公司供應商，他的交貨不\r\n    能有任何問題，因為友達產品上用到的元件大致上有幾百顆\r\n    ，不能因為一個材料而無法出貨，所以需導入第二家或第三\r\n    家的材料，就不怕任何斷料等語（桃院易卷(二)第171 頁背面\r\n    、第172頁、第175頁）。是以雖依證人林俊良證稱：要成為\r\n    友達公司合格供應商，尚需經過友達公司驗證品質合格，且\r\n    需針對價格競爭力、公司供貨能力及財務狀況進行評估等語\r\n    （筆錄附於北檢他卷第85頁），仍堪認友達公司所以於99年\r\n    6 月間就艾美公司產品進行驗證並認證其供應商資格，與饒\r\n    瑞鈞於99年5、6月間利用友達公司為穩定原料供應之主觀心\r\n    態，悖於忠誠向友達公司研發工程師林俊良謊稱高柏公司即\r\n    將斷料，艾美公司則為原料之原廠云云，確互為因果。\r\n  (3)再者，關於林俊良於99年4月8日即就其所開發新機種之材料\r\n    清單申請高柏公司為供應商乙節，固有前揭友達公司103年4\r\n    月10日函檢附明細可稽（原審重勞訴卷(八)第113頁； 桃院易\r\n    卷(一)第71頁、第141頁）， 並據友達公司101年4月11日回覆\r\n    公平交易委員會函敘明確（ 原審重勞訴卷(八)第112頁）。然\r\n    證人林俊良已證稱：此乃因當時高柏公司為Li98導熱膠帶之\r\n    唯一合格供應商，而新機種既指定需使用LI98導熱膠帶料材\r\n    ，材料清單復係在友達公司系統上建立，所以該清單上之廠\r\n    商當然仍為高柏公司等語（桃院易卷(二)第16頁背面）。再參\r\n    以友達公司採購之原則，係以供應商資格取得為前提，既有\r\n    友達公司前揭函文可憑（原審重勞訴卷(八)第112頁）。則僅\r\n    以林俊良將高柏公司列入該新機種之材料清單乙節，自無從\r\n    認為林俊良前揭證詞有何虛偽不實。被上訴人雖另質疑，該\r\n    新機種材料清單既係於99年4月8日即已建立，即得進行採購\r\n    ，饒瑞鈞自無可能於事後再送樣3次及為不實陳述，亦未造\r\n    成上訴人任何損害云云。然證人林俊良已於刑案審理時證稱\r\n    ：應該是說，此材料在友達公司內部是認證合格的，所以伊\r\n    材料清單可以建立，因為可以買，買得到，伊不用再做基本\r\n    測試，用的時候在我的產品上再測試一次是否有其他問題；\r\n    基本的測試例如此膠帶有基本特性如黏性、散熱能力是否符\r\n    合規格，此測試經驗證通過才會在公司內部有所謂供應商代\r\n    號。伊在做新產品測試時，在公司系統已經可以抓到他，所\r\n    以伊可以買，買進來以後可以作為伊新產品新機種的驗證，\r\n    這是屬於我的產品整個模組的驗證，並非材料本身的驗證，\r\n    所以伊於99年4月8日建立此新機種之料號清單為高柏公司後\r\n    ，採購人員就可以按照此材料部件清單向高柏公司採購材料\r\n    進行試產，因為這個材料雖然在公司是合格，但並沒有在伊\r\n    這支新產品上用過，需測試後沒有問題，才能放量；也就是\r\n    說，在99年4月8日建立材料部件清單後，僅由高柏公司就新\r\n    產品的測試進行三次送樣，是試產階段，尚未正式放量，但\r\n    試產時就需要指定材料部件清單，由採購人員購買後提供試\r\n    產使用，因為採購有備料伊才能進行試產，試產時間係材料\r\n    部件清單建立之後，且該新產品試產確實已經完成；但試產\r\n    完成尚需召開放量過議通過後始可量產，因後續係由他人承\r\n    接伊工作，故新產品是否已量產，伊並不清楚等語（桃院易\r\n    卷(二)第18頁至第20頁）。證人熊國佑亦證稱：必需已是友達\r\n    公司合格供應商，開發部才能申請到料號，接下來還要驗證\r\n    通過，開發部人員才能在部件材料清單申請料號，99年4月8\r\n    日就是林俊良申請料號的時間，採購人員才能購買等語（桃\r\n    院易卷(二)第168頁）。再參以證人巫江昌證稱：友達公司的\r\n    供應商與材料驗證是兩件事情，合格供應商是必須友達公司\r\n    採購、研發、供應商管理三部門同意之後會有一個編碼；材\r\n    料驗證是只要送給研發，我們就可以幫他驗，要買材料就需\r\n    要驗證，驗證的話不需要有合格供應商的資格，但如果沒有\r\n    合格供應商資格，驗證也沒有用，因為友達公司的採購也不\r\n    能買貨等語（桃院易卷(三)第62頁）。綜上證詞，堪認證人林\r\n    俊良所以就新機種先建立材料清單，並以當時Li98導熱膠帶\r\n    唯一合格供應商即高柏公司列入清單，旨在取得材料為新機\r\n    種進行產品驗證，且係為產品驗證之目的始由饒瑞鈞代表上\r\n    訴人送樣3次至明。則其先於99年4月8日於部料清單申請由\r\n    高柏公司為供應商，再通知上訴人送樣3次進行新機種驗證\r\n    ，於時間及清單內容俱無矛盾。至於饒瑞鈞利用其代表上訴\r\n    人3次送樣予林俊良之機會，向林俊良為前開不實且不利於\r\n    上訴人之陳述，致使林俊良誤認上訴人有斷料可能，並誤認\r\n    該原料之原廠為艾美公司，既意圖在為同業競爭之艾美公司\r\n    爭取成為友達公司供應商，藉以獲取與友達公司日後交易之\r\n    資格。此實與該次新機種於材料清單上之供應商是否仍建立\r\n    為上訴人，或該新機種是否量產、是否實際向上訴人採購之\r\n    結果，並無關聯。被上訴人執此率論林俊良之證詞為不可採\r\n    云云，自無可取。\r\n  ④蔡建宏及饒瑞鈞復抗辯：就友達公司採購人員劉暐辰所負責\r\n    之導熱矽膠部分，早於饒瑞鈞與劉暐辰接觸之99年7、8月間\r\n    ，其供應商已非僅高柏公司一家，艾美公司亦為其中之一，\r\n    則劉暐辰證述係因伊不同意配合降價或降價不如預期，並由\r\n    伊建議向艾美公司採購，亦顯然不實云云。然查艾美公司於\r\n    99年6 月14日登記為友達公司之合格供應商後，饒瑞鈞復於\r\n    99年7 月以後向友達公司採購人員劉暐辰表示上訴人降價不\r\n    易，並另推薦向艾美公司採購導熱矽膠乙節，已如前述。又\r\n    證人即友達公司TV顯示器開發部經理熊國佑雖證稱：導熱矽\r\n    膠（THERMAL PAD）部分之供應商於99年8月18日已有高柏公\r\n    司、SONY公司、先鋒公司及艾美公司，且導熱矽膠部分，確\r\n    實是為了健全供應鍊，所以進行各廠商材料特性比較，藉以\r\n    引入其他供應商，並使供應商相互競爭等語（筆錄附於桃院\r\n    易卷(二)第169頁、第171頁背面、第172頁、第175頁；筆錄影\r\n    本附於原審重勞訴卷(八)第132頁背面、第139頁）。然其亦證\r\n    稱：劉暐辰所負責採購的導熱矽膠供應商於99年8 月18日原\r\n    本有高柏公司、日商SONY公司、先鋒公司、艾美公司4 家公\r\n    司為合格供應商，但TV部門有用到的就只有高柏公司及SONY\r\n    公司，又因為SONY公司導熱矽膠比較貴，如果可以不用，就\r\n    選擇台灣廠商，即就非SONY的產品，就使用高柏公司的產品\r\n    ；然因採購人員劉暐辰告知高柏公司之降價幅度不符合採購\r\n    要求，所以才在TV部門亦導入艾美及先鋒公司以擴大供應鏈\r\n    等語（桃院易卷(二)第173頁背面、第174 頁、第175頁背面、\r\n    第176 頁），可知證人劉暐辰前揭證詞就導入艾美公司為供\r\n    應商或導入為採購對象乙節，於措詞上或有混淆，然綜合上\r\n    情，仍堪認友達公司就TV部門之導熱矽膠部分所以導入艾美\r\n    公司為採購對象，確與饒瑞鈞向劉暐辰告知高柏公司無法配\r\n    合降幅且推薦向艾美公司攸關。況饒瑞鈞既係違約於上訴人\r\n    在職期間，違反忠誠向友達公司推薦與上訴人競爭之同業艾\r\n    美公司交易，勢將造成上訴人客戶流失之結果。是無論上訴\r\n    人是否友達公司導熱矽膠之唯一供應商，均無從卸免其違約\r\n    及侵權行為至明。\r\n  ⑤至於上訴人於艾美公司以前揭不正競爭方式取得合格供應商\r\n    資格後，與友達公司仍有交易乙節，固有友達公司103年4月\r\n    10日函檢附明細可稽（原審重勞訴卷(八)第185 頁；桃院易卷\r\n    (一)第71頁、第96頁）。被上訴人並抗辯：艾美公司與友達公\r\n    司之首次交易乃在100年3月24日，且交易品項為導熱矽膠，\r\n    與導熱膠帶無關，可推知饒瑞鈞並無不實陳述，亦無造成上\r\n    訴人損害；上訴人與友達公司間業績減少，實係因友達公司\r\n    營業及景氣影響云云，並引據友達公司103年11月18 日友達\r\n    發字第1031119號函、友達公司103年11月21日桃院勤刑育10\r\n    3年49字第1030019213號陳報狀為憑（桃院易卷(三)第1頁、第\r\n    8頁）。然查：\r\n  (1)審酌艾美公司於99年6 月14日成為合格供應商後（原審重勞\r\n    訴卷(八)第216頁、第208頁），上訴人之供應商資格既仍存在\r\n    。堪認艾美公司本於不正競爭行為取得友達公司合格供應商\r\n    資格，所損及上訴人者，乃其與友達公司及其集團供應鏈廠\r\n    商間之締約機會至明。則僅以上訴人於艾美公司取得供應商\r\n    資格後，與友達公司仍有交易乙節，自無從據為饒瑞鈞並無\r\n    不實陳述或所為未對上訴人造成損害之佐證。\r\n  (2)況依證人蕭酩献於刑案中證稱：林俊良在伊負責研發的新機\r\n    種最後並沒有購買高柏的Li98導熱膠帶，在此事發生後，後\r\n    續有採購是在此時間點前的舊的Li98導熱膠帶特定專案還是\r\n    有用高柏的，99年時間過後，隨著新承認的料件，漸漸艾美\r\n    公司已經導入友達公司，高柏公司在新的案子上基本上已經\r\n    沒有接到友達公司的訂單；友達公司提出料單明細上99 年4\r\n    月8日料號「G220SW02」，是屬於舊案，饒瑞鈞是在99年5、\r\n    6 月間去找林俊良，伊是以事情發生的時間點去區分，這個\r\n    案子是在饒瑞鈞還沒去跟林俊良誆稱艾美公司是原材料的供\r\n    應商以前發生的事情，也就是伊認知舊案，在當下發生的時\r\n    間後，只剩一、二個機種還有在使用，是新開發的機種，在\r\n    101年以後，就有恢復多一點新機種使用高柏公司的產品 ，\r\n    這是因為在100年3、4月間發現事實後，積極爭取客戶 ，讓\r\n    客戶瞭解，有慢慢恢復，但中間的損失非常大；至於友達公\r\n    司提供的料單中於99年5、6月至99年12月底饒瑞鈞離職時建\r\n    立之12個新機種料單，均係導熱矽膠，並非Li98導熱膠帶（\r\n    TAPE DOUBLESIDE）等語（刑案桃院易卷(二)第5頁、第8頁至\r\n    第10頁、第14頁）。核與友達公司提供之交易明細顯示於99\r\n    年6月迄100年間，上訴人與友達公司間之交易僅有2件（桃\r\n    院易卷(一)第96頁），尚相符合。反觀艾美公司於99年5、6月\r\n    前尚非友達公司合格供應商，卻於饒瑞鈞前揭不實陳述後迅\r\n    速於99年6月14日取得合格供應商資格，已如前述。另據被\r\n    上訴人依刑案友達公司函檢附歷年材料部件清單自行整理艾\r\n    美公司於99年、100年及101年度經列入材料清單成為採購對\r\n    象者分為別12件、39件及12件（桃院易卷(一)第197頁），並\r\n    有該函件及明細存於刑案卷內可憑（桃院易卷(一)第71頁、第\r\n    149頁、第150頁）。此對照上訴人於艾美公司成為合格供應\r\n    商前之96年至98年度，經列入部料清單之機種數量分別為60\r\n    件、 83件及70件，於99年至101年度則驟減為24件、5件、1\r\n    件（桃院易卷(一)第140頁至第146頁、第149頁、第150頁、第\r\n    174頁、第175頁、第197頁）。益見上訴人主張：友達公司\r\n    因誤信饒瑞鈞前揭上訴人可能斷料之不實傳述，及因艾美公\r\n    司以不正方式取得合格供應商資格後，確因而減少與高柏公\r\n    司之訂購交易，並積極將艾美公司列入料號清單進行交易，\r\n    是以上訴人雖仍具有供應商資格，然其實際交易機會確甚受\r\n    影響等語，確非無稽。\r\n  (3)再查艾美公司與友達公司之首次交易雖係於100年3月間。然\r\n    依證人蕭酩献證稱：友達公司是主要設計，承認產品的公司\r\n    ，其下游廠商亦僅接受友達公司承認那些零件可以使用依照\r\n    指示購買材料的公司等語（桃院易卷(二)第14頁）；以及友達\r\n    公司104年12月22 日民事陳報狀表示：伊公司供應鏈集團之\r\n    其他公司會提供品項及其採購成本予伊公司參考，供應鏈集\r\n    團之其他公司如認為品質有問題，也會反應到伊公司品質管\r\n    理系統進行釐清與確認。又伊公司之供應商代碼（ vender\r\n    code)取得及物料清單(BOM表)申請均須經過系統相關單位的\r\n    簽核核准後才會生效，生效後，始能將產品放進物料清單(\r\n    B0M表）供伊公司所屬之供應鏈（本院卷(二)第263頁）集團之\r\n    其他公司採購。再依科技業原物料採購習慣，針對所屬供應\r\n    鏈集團之其他公司是會指定採購特定產品。至於伊公司之供\r\n    應鏈集團廠商則包括友達光電股份有限公司、友達光電（廈\r\n    門）股份有限公司，達運精密工業（廈門）股份有限公司，\r\n    達運精密工業（蘇州）有限公司、輔祥實業股份有限公司，\r\n    輔訊光電工業（蘇州）股份有限公司、台灣表面黏著科技股\r\n    份有限公司，峻凌電子（廈門）有限公司，峻凌電子（蘇州\r\n    ）有限公司，峻凌電子（寧波）有限公司，，峻凌電子（東\r\n    莞）有限公司、中強光電股份有限公司，蘇州燦宇光學有限\r\n    公司，上海燦宇光學有限公司，環鴻電子股份有限公司，環\r\n    鴻科技股份有限公司，環隆電氣股份有限公司，環旭電子（\r\n    上海）有限公司，環旭電子（深圳）有限公司、瑞儀光電股\r\n    份有限公司，蘇州瑞儀光電股份有限公司、佳世達科技股份\r\n    有限公司，蘇州佳世達電通有限公司、富積電子股份有限公\r\n    司：廈門富積電子有限公司、威力盟電子股份有限公司、州\r\n    巧科技股份有限公司，州巧科技（廈門）有限公司、景智電\r\n    子股份有限公司、隆達電子股份有限公司、達方電子股份有\r\n    限公司在內；而艾美公司確係於99年6月14日成為伊公司合\r\n    格供應商等語，有該函在卷可據（原審重勞訴卷(八)第216頁\r\n    、第208頁）。可知上訴人因艾美公司不正競爭行為所造成\r\n    之損害，絕非僅為與友達公司之交易機會，尚包括友達集團\r\n    下前揭各廠商在內之締約獲利，亦甚明瞭。是以艾美公司於\r\n    99年6月14日成為友達公司供應商後，雖迄100年3月間始與\r\n    友達公司首次進行交易。然經檢視前揭友達公司集團廠商中\r\n    ，確有諸如輔祥實業股份有限公司於99年7月23日起就導熱\r\n    膠帶與艾美公司有多筆交易(原審重勞訴卷(三)第102頁)；另\r\n    達運精密工業（蘇州）有限公司及中強光電股份有限公司分\r\n    別自99年12月9日、99年10月5日起與艾美公司開始就導熱矽\r\n    膠發生交易(原審重勞訴卷(三)第141頁、第154頁)；上海燦宇\r\n    光學有限公司則自99年6月21日起與艾美公司就導熱膠帶進\r\n    行多筆交易（原審重勞訴卷(三)第160頁）等情，有各該公司\r\n    檢送之交易明細存卷可憑。足認艾美公司除藉由前揭不正競\r\n    爭行為取得友達公司之合格供應商資格，並已憑藉此項資格\r\n    與友達公司及其集團供應鏈廠商實際進行交易，於事實上確\r\n    已損及上訴人之締約機會及市場利益至明。被上訴人抗辯上\r\n    情，顯然刻意忽視艾美公司與其他友達公司集團供應鏈廠商\r\n    就導熱膠帶及導熱矽膠前揭頻繁之交易事實，亦無從憑信。\r\n  4.承上各節，茲審酌饒瑞鈞與蔡建宏不僅於任職上訴人公司期\r\n    間，即違反僱傭契約關於任職期間競業禁止之約定，與艾美\r\n    公司實質負責人李維鋐共同設立經營與上訴人同業競爭之艾\r\n    美公司，且於蔡建宏離職後，推由尚在職之饒瑞鈞利用其代\r\n    表上訴人向友達公司洽接業務之機會，向友達公司傳述高柏\r\n    公司將斷料之不實訊息，並誆稱艾美公司為原廠及向友達公\r\n    司推介與艾美公司交易；蔡建宏則利用饒瑞鈞仍在職期間所\r\n    獲取之客戶交易資訊，代表艾美公司與友達公司及其集團鏈\r\n    廠商接洽聯繫交易事宜，艾美公司因而得以遂行其獲取高柏\r\n    公司與其原有客戶締約利益之目的，並造成上訴人流失原有\r\n    客戶之結果，既均經認定。所為顯係共同以背於善良風俗之\r\n    方式，從事不公正之競爭。堪認上訴人主張：饒瑞鈞與蔡建\r\n    宏不僅應依僱傭契約第12條、民法第226條、第227條規定就\r\n    伊公司所受損害負債務不履行之損害賠償責任，渠等與李維\r\n    鋐亦應依民法第184條第1 項後段、第185條共同侵權行為之\r\n    規定負連帶賠償責任。又李維鋐既為於艾美公司實質負責人\r\n    ，蔡建宏為艾美公司之受僱人，饒瑞鈞於實質亦依艾美公司\r\n    之指示為其服勞務，艾美公司自應依民法第28條、第188 條\r\n    規定連帶賠償等語，洵屬有據。上訴人其餘請求權基礎，自\r\n    毋庸再予審酌。\r\n  5.至於上訴人主張：王苡倫亦違反僱傭契約競業禁止約定，且\r\n    亦參與饒瑞鈞、蔡建宏及李維鋐前揭不法侵權行為云云，業\r\n    據王苡倫否認。又王苡倫雖自承於99年3 月自高柏公司離職\r\n    後，即自99年7 月起至艾美公司擔任業務助理，已如前述。\r\n    其胞弟王令威並於艾美公司100年4月22日辦理增資時，登記\r\n    為艾美公司股東乙節、亦有艾美公司變更登記表影本可稽（\r\n    原審重勞訴卷(一)第47頁、第48頁，原審重勞訴卷(八)第254 頁\r\n    正、背面）。然兩造間離職後競業禁止約款既屬無效，自不\r\n    能僅以王苡倫於離職2 年內即任職於同業之艾美公司，即逕\r\n    認有何違約或侵權情事。況王苡倫復於刑案偵查中表示：王\r\n    令威雖是伊胞弟，但是伊於100年4月間介紹王令威投資艾美\r\n    公司，當時艾美公司要增資，伊不想投資，所以就找伊弟弟\r\n    投資等語（桃檢偵續一卷第71頁）。則上訴人既未舉證證明\r\n    王令威於艾美公司股份乃王苡倫借名登記，復未證明王苡倫\r\n    於高柏公司任職期間或離職後，有參與蔡建宏、饒瑞鈞前揭\r\n    不法行為或有何其他違背忠誠義務且以不公平競爭方式侵害\r\n    上訴人營業利益之情事。則上訴人主張：王苡倫應就其損害\r\n    負侵權及債務不履行之損害賠償責任云云，自難認有據。\r\n  6.又上訴人雖另指：饒瑞鈞於在職期間尚曾將伊公司與客戶東\r\n    貝公司歷經業務接洽、送交型錄、試模等程序耗時半年有餘\r\n    ，且經第一次量產後之客製化散熱背膠產品規格洩露移轉予\r\n    艾美公司，由艾美公司向東貝公司報價成交，再由已離職之\r\n    蔡建宏及王苡倫負責後續艾美公司接單作業。且饒瑞鈞及蔡\r\n    建宏、王苡倫就其所負責瑞儀公司，亦同有上開情形。另饒\r\n    瑞鈞自伊公司離職後，更於100年3、4 月間至友達公司台中\r\n    廠供應商規格說明會大肆發放名片，為艾美公司招攬客戶；\r\n    且向友達公司及冠捷公司等客戶聲稱任職於艾美公司，該公\r\n    司所售產品與伊公司品質相同但價格更為低廉云云，將客戶\r\n    引介至艾美公司。饒瑞鈞復於同年4、5月間得知友達公司台\r\n    中廠巫江昌有新案件擬與伊公司聯繫，竟與蔡建宏主動聯絡\r\n    巫江昌，誆稱艾美公司為伊公司之子公司，可直接向艾美公\r\n    司洽談訂單，致巫江昌誤信其言改向艾美公司下單。艾美公\r\n    司則在蔡建宏、王苡倫離職員工協助下，仿製伊公司型錄以\r\n    利業務推廣。而李維鋐乃艾美公司實際負責人，其除利用蔡\r\n    建宏、饒瑞鈞及王苡倫知悉及提供之營業資料及上開行為，\r\n    共同以低價搶原屬伊公司之市場及締約機會以進行不公平競\r\n    爭外，尚於100年7月18日以電子郵件傳送下游廠商張銘利等\r\n    18人，並指：伊公司為不肖廠商，以黑函抹黑艾美公司云云\r\n    ，已損害伊公司之信譽云云。然查：\r\n  ①經核對上訴人所提出艾美公司於99年1 月22日提供予東貝公\r\n    司報價單，雖與上訴人98年12月14日出貨予東貝公司之對帳\r\n    單所顯示產品規格及單價一致乙節，有各該報價單及對帳單\r\n    影本可稽（原審重勞訴卷(一)第54頁至第56頁）。其上所使用\r\n    料號名稱亦為上訴人於東貝公司所建立料號Li98乙節，亦有\r\n    銷貨明細表、統一發票及附表，以及產品網頁截圖，暨上訴\r\n    人自行提出之銷貨單及統一發票為佐（本院卷(二)第74頁至第\r\n    78頁、第187頁、第85頁、第86 頁）。然依證人張文忠於刑\r\n    案偵查中證稱：伊為東貝公司光電工程師，伊一開始是跟高\r\n    柏公司合作，高柏公司是我們的供應商，但從去年（99年）\r\n    開始都是跟艾美公司接洽比較多，這是因為我們客戶捷聯電\r\n    子要求轉跟艾美公司合作，伊雖不知道原因，但應該是沒有\r\n    削價競爭；就伊所知，高柏公司與艾美公司產品的相似度極\r\n    高，他們的規格是一樣的，但規格是依照客戶的要求，且他\r\n    們的產品名稱並不相同，蔡建宏在任職高柏公司時，並沒有\r\n    向伊推薦艾美公司的產品，都是客戶要求的等語（筆錄影本\r\n    附於原審重勞訴卷(八)第136頁正、背面；桃檢他卷第167頁、\r\n    第168 頁）。其亦於本院審理時證稱：東貝公司是冠捷集團\r\n    之供應鏈之一，產品的設計與組裝是在東貝公司完成，零件\r\n    及材料係外面廠商提供，因為產品並非固定公版，所以要請\r\n    供應商做出符合規格之原物料提供使用，當冠捷公司跟我說\r\n    要產品時，我們會根據東貝公司現有的供應商所提供的材料\r\n    去生產樣品給冠捷公司測試，初期確定原物料來源後原則上\r\n    就不會更改，但如果在生產過程中有來不及交貨或交貨不足\r\n    ，採購人員會要求增加供應商來生產相同的東西。東貝公司\r\n    一開始是跟高柏公司接觸，後續就轉向艾美公司，這是因為\r\n    捷聯電子即冠捷公司要求，實際是什麼原因伊不清楚，也不\r\n    清楚有沒有削價競爭的事情，採購人員覺得冠捷公司要求產\r\n    品的背膠使用艾美公司，有介紹我們使用，這是冠捷公司研\r\n    發人員介紹的，捷聯公司就是冠捷公司。在伊離職之前，是\r\n    與艾美公司配合，印象中去冠捷公司開會時，建議我們用艾\r\n    美公司，因為客戶這樣講，測試沒問題，配合度也很好，就\r\n    繼續用，至於價格是採購人員才知道，實際上買不買也是看\r\n    採購人員等語（本院卷(二)第137頁背面至第141頁）。再參以\r\n    證人曾怡寧證稱：伊任職東貝公司擔任採購經理，伊知道冠\r\n    捷公司，東貝公司有幫該公司製作背光模組，並向艾美公司\r\n    採購背光模組的散熱膠條，伊不記得具體開始採購的時間，\r\n    但艾美公司一直有存在東貝公司的供應鏈內，冠捷公司並沒\r\n    有指定需向艾美公司採購，僅表示材料價格要有競爭性，也\r\n    就是價格要低，東貝公司向艾美公司採購，是由工程師決定\r\n    ，工程師在產品生產前，會先確定產材料供應商，採購下單\r\n    後，會再將其他廠商抓進來進行比價，所以材料的採購是由\r\n    工程師、品管人員及採購人員共同決定等語（本院卷(二)第24\r\n    5頁背面至第248頁）；及證人蔡曜聰證稱：伊是冠捷電子公\r\n    司工程師，冠捷公司是向東貝公司購買背光模組，是裝置顯\r\n    示器後方的零件，伊於2011年進公司時，東貝公司就已經是\r\n    冠捷公司的供應商，冠捷公司會確認材料供應商的品質是否\r\n    沒有問題，且需確認至少要有兩家材料供應商，我們提供材\r\n    料供應商後，再請東貝公司自行稽核決定選擇哪一家公司。\r\n    伊進入冠捷公司時，高柏公司就已是我們提供給東貝公司的\r\n    供應商，而且當時只有高柏公司作為東貝公司的材料供應商\r\n    ，後續伊有找了7、8家進行驗證，當時是艾美公司自己來找\r\n    伊，好像是Johnson ，伊記得是他們自己來找伊的，驗證時\r\n    是由冠捷公司提供材料尺寸，艾美公司提供材料，除了單純\r\n    材料尺寸外，會使用東貝公司的材料與艾美公司提供的材料\r\n    進行組裝及測試，至於這個規格應該是冠捷公司、東貝公司\r\n    等上游公司及高柏公司等材料供應商決定。經驗證後伊有確\r\n    認艾美公司及博霖公司二家供應商提供給東貝公司稽核，從\r\n    驗證到確定前後大約耗時3、4個星期，伊有告知艾美公司及\r\n    博霖公司兩家值得信賴，至於東貝公司採購哪一家，東貝公\r\n    司不會告訴我們，但伊看到東貝公司採用的供應商材料幾乎\r\n    都是艾美公司，就伊所知，因另家模組供應商億光公司大部\r\n    分都是採用博霖公司的材料，我覺得可能是每家公司的採購\r\n    策略關係。伊只是多提供艾美公司給東貝公司，但沒有指定\r\n    要東貝公司向艾美公司採購，我們不能指定模組供應商的材\r\n    料採購對象等語（本院卷(二)第248頁至第250頁）。併參酌東\r\n    貝公司104年9月25日函亦稱：伊公司確為冠捷集團供應鍊之\r\n    一；如冠捷集團認為有必要，亦會對伊公司指定部分物料廠\r\n    商；伊公司導入艾美材料為供應商係因客戶介紹（據採購人\r\n    員記憶，當時工程人員之用語的確是客戶介紹，但依照當時\r\n    氛圍及情況，指定意味濃厚）等語，有該函文可憑（原審重\r\n    勞訴卷(八)第152 頁）。則綜合上開事證，可知東貝公司所以\r\n    向艾美公司訂購材料，應係由艾美公司主動向東貝公司之客\r\n    戶即冠捷電子公司洽商取得材料驗證，再由冠捷電子公司推\r\n    介由東貝公司決定採購之結果；至於艾美公司提出報價單上\r\n    之產品規格及金額所以與上訴人之報價資料相當，或係因產\r\n    品規格皆由東貝公司之客戶指定，及因市場競爭機制致有報\r\n    價相當之情形，此均無非出於一般同業間競爭，並無從逕認\r\n    被上訴人有何以洩露產品規格及報價資料或以其他不正方式\r\n    爭取與東貝公司交易機會之情事。準此，上訴人雖亦主張：\r\n    艾美公司與上訴人向瑞儀公司報價之產品規格完全一致，可\r\n    證被上訴人亦有以前揭相同手法侵奪伊公司與瑞儀公司間交\r\n    易機會之不法行為云云，並提出報價明細影本為據（原審重\r\n    勞訴卷(一)第61頁）；暨另主張：饒瑞鈞曾向冠捷公司及友達\r\n    公司體系工廠聲稱艾美公司所售產品與伊公司品質相同，但\r\n    價格更為低廉，以掠奪伊公司客戶云云，舉證既有未足，均\r\n    不能採取。\r\n  ②又上訴人主張：饒瑞鈞及蔡建宏曾於100年3、4 月間向友達\r\n    公司巫江晶表示艾美公司是子公司，藉以推薦艾美公司成為\r\n    供應商云云，業據蔡建宏否認，僅表示：曾幫艾美公司提供\r\n    型錄給巫江昌，且巫江昌部門沒有生產，艾美公司產品於該\r\n    部門亦尚未通過認證；艾美公司雖然已是友達公司大尺寸、\r\n    中尺寸導熱材料的供應商，但因友達公司不同單位認證通過\r\n    的廠商不同，且巫江昌是友達公司台中的部門，劉暐辰是新\r\n    竹的部門，所以艾美在台中不是供應商，在新竹則是等語（\r\n    筆錄附於北檢他卷第71頁）。另依饒瑞鈞自承自高柏公司離\r\n    職後，曾使用艾美公司為其印製之名片參加友達公司說明會\r\n    ，並為艾美公司招攬業務等語（桃檢偵續卷第243 頁）。雖\r\n    可認饒瑞鈞於自上訴人公司離職後，確有為艾美公司提供勞\r\n    務或服務之情。然依證人巫江昌於刑案偵查中證稱：伊與饒\r\n    瑞鈞接觸時，他推薦的是艾美公司的產品，當時我們都認為\r\n    他是高柏公司的員工，因為之前就跟他合作過，但他並沒有\r\n    特別提到艾美公司是高柏公司的子公司，也沒有特別解釋艾\r\n    美公司與高柏公司的關係，伊有問過，但他沒有回答等語（\r\n    北檢他卷第64頁；筆錄影本附於原審重勞訴卷(八)第34頁）；\r\n    復於刑案審理時證稱：伊自96 年至101年11月任職友達公司\r\n    擔任產品設計及材料驗證工作，伊任職期間，友達公司曾向\r\n    高柏公司購買導熱矽膠，饒瑞鈞一開始是介紹高柏公司的產\r\n    品，後來在99年、100 年間饒瑞鈞才到艾美公司工作，饒瑞\r\n    鈞係在100年5月間才代表艾美公司與伊接觸，也是出售導熱\r\n    膠帶、導熱矽膠及導熱膏等材料。伊是有聽過說艾美公司是\r\n    高柏公司的子公司，但伊覺得無法證實，伊也不記得是何人\r\n    傳述等語（桃院易卷(三)第59頁背面、第62頁背面）。自無從\r\n    認為饒瑞鈞及蔡建宏於離職後曾散播艾美公司為高柏公司子\r\n    公司之不實訊息。又依前所述，系爭僱傭契約所約定離職後\r\n    競業禁止條款應屬無效，則除前揭饒瑞鈞、蔡建宏、李維鋐 \r\n    及艾美公司共同違背善良風俗之侵權行為外，關於饒瑞鈞離\r\n    職後，其與蔡建宏為艾美公司提供勞務或服務，以及為艾美\r\n    公司接觸並招攬爭取與包括友達公司在內之客戶交易之行為\r\n    ，核屬與上訴人同業間之商業競爭行為，更不能逕認有何違\r\n    反契約義務或違反善良風俗之行為。從而，上訴人主張蔡建\r\n    宏及饒瑞鈞尚有前揭違約及侵權行為，並應為此負債務不履\r\n    行或侵權行為責任云云，自不能採取。\r\n  ③再查，上訴人雖指：蔡建宏、王苡倫、饒瑞鈞有侵占渠等於\r\n    任職伊公司期間持有之樣品盒、型錄、產品測試報告及贈品\r\n    ，於離職後攜往艾美公司繼續使用，並作為渠等取信、誤導\r\n    客戶使用。艾美公司更在蔡建宏、王苡倫等離職員工協助下\r\n    仿製伊公司型錄，以利其業務推廣云云，並提出指封切結及\r\n    型錄影本、型錄為證（原審重勞訴卷(一)第57 頁、第102頁至\r\n    第137頁，原審重勞訴卷(四)第109頁至第137 頁）。且檢視上\r\n    訴人與艾美公司之型錄於描述方式、品項排列及產品說明，\r\n    亦見有雷同之處。然依證人即東貝公司光電工程師張文忠於\r\n    刑案偵查中證稱：關於高柏公司的型錄，只要跟供應商就可\r\n    以要得到，這是非機密的東西，因為裡面沒有提到產品成分\r\n    等語（筆錄影本附於原審重勞訴卷(八)第136 頁正、背面；桃\r\n    檢他卷第167頁、第168頁）。另證人即高柏公司客戶之一之\r\n    鴻酉精密企業有限公司業務經理詹銘凱亦於刑事偵查中證稱\r\n    ：包括艾美公司及高柏公司在內，一般的產品型錄是我們下\r\n    游廠商就可以取得，在網路上也可以取得，非屬機密，產品\r\n    型錄本來在業界就會互相參考，所以就算型錄相似也是正常\r\n    的等語（筆錄附於桃檢他卷第171 頁）。堪認上訴人之型錄\r\n    實屬市場上流通之公開資訊，並不具營業秘密性質，尚不能\r\n    認為艾美公司型錄乃仿製。至於在艾美公司查扣之樣品盒、\r\n    產品測試報告及贈品、便條紙等等，依其性質，亦均屬上訴\r\n    人在市場上爭取與客戶交易機會所提出公開之資訊及物件，\r\n    不僅未具營業秘密性，更屬上訴人刻意釋放於市場上流通之\r\n    商品訊息，自不能認為被上訴人有何侵占及誤導客戶之情事\r\n    。上訴人執此節主張權益受損云云，亦乏所據。\r\n  ④另上訴人主張：蔡建宏於離職後，配合將艾美公司網站上偽\r\n    稱艾美公司早於1998年成立工廠及2009年成立業務部，以取\r\n    信客戶等語，雖引據其於蔡建宏、饒瑞鈞被訴刑案中提出10\r\n    0年7月21日艾美公司網頁資料、公平交易委員會101年12月1\r\n    2 日新聞資料及公平交易委員會處分書等件（均影本）為證\r\n    （北檢他卷第7499號卷第14頁，桃檢偵續一卷第14頁、第96\r\n    頁至第101 頁）。審酌上開網頁資訊雖與艾美公司實際於98\r\n    年11月10日設立乙節未符，並經公平交易委會認定係屬虛偽\r\n    不實及引人錯誤之表示，已違反公平交易法第21條第1 項規\r\n    定。然僅此實無從認與上訴人營收增減有何相當因果關係。\r\n    則上訴人指摘艾美公司此項上開網頁不實記載，亦構成侵權\r\n    行為云云，不能採取\r\n  ⑤至於上訴人主張：李維鋐於100年7月18日以電子郵件傳送其\r\n    下游廠商張銘利等18人，指稱：高柏公司為不肖廠商，以黑\r\n    函抹黑艾美公司云云，已損害高柏公司之名譽及信譽等語，\r\n    雖據提出電子郵件影本及附件聲明書影本為憑（原審重勞訴\r\n    卷(一)第67頁、第68頁）。然檢視該電子郵件記載：「針對近\r\n    日某代理商對敝司艾美材料科技有限公司所發之黑函，附件\r\n    為敝司嚴正之聲明書，也將對造謠之人及其所屬公司提出毀\r\n    謗與損害商譽訴訟，以正視聽」等語；其附件聲明書除強調\r\n    艾美公司產品及材料品質通過認證、客戶數量穩定以外，另\r\n    聲稱：「....卻有業界不肖代理商，一再以黑函抹黑、汙衊\r\n    之手段企圖影響敝司目前出貨之客戶，目前敝司已委由律師\r\n    針對劉彥廷先生及其所屬之高柏科技有限公司提出誹謗及損\r\n    害商譽之告訴，以正視聽」等語，核其內容無非向其往來交\r\n    易客戶澄清並無上訴人對其指控各節，且聲明就兩造間爭議\r\n    將訴諸法律裁斷，於客觀上尚不致造成上訴人商譽之損害。\r\n    則上訴人執此指摘李維鋐以不實電郵損及伊公司商譽，應負\r\n    擔侵權行為責任云云，亦未能採取。\r\n五、承上所述，上訴人於前揭四、5.所主張被上訴人各項違約及\r\n    侵權行為事實，雖不能成立。然上訴人主張：饒瑞鈞、蔡建\r\n    宏、李維鋐及艾美公司應就饒瑞鈞、蔡建宏任職上訴人公司\r\n    期間違反競業禁止約定與李維鋐共同設立經營與上訴人同業\r\n    競爭之艾美公司，並由尚在職之饒瑞鈞向友達公司傳述不利\r\n    於高柏公司之不實訊息並推介與艾美公司交易，及由蔡建宏\r\n    利用饒瑞鈞提供交易訊息代表艾美公司與友達公司及其集團\r\n    鏈廠商接洽聯繫交易事宜，致造成上訴人流失原有客戶之損\r\n    害結果，負擔侵權行為連帶賠償責任等情，既經前揭四、1.\r\n    至4.認定明確。茲就饒瑞鈞、蔡建宏、李維鋐及艾美公司所\r\n    應連帶負擔之損害賠償金額認定如下：\r\n  (一)上訴人主張：因艾美公司、李維鋐、蔡建宏、饒瑞鈞上揭行\r\n    為造成伊公司高達3億9223萬9242元之業績衰退之損害(原審\r\n    重勞訴卷(六)第303頁至第309頁)；僅以100年1月至7月之銷貨\r\n    金額與前一年度相較，亦大幅衰退6709萬3074元，爰先以此\r\n    為一部請求等語，雖據提出銷貨比較表及進銷明細表為證（\r\n    原審重勞訴卷(一)第72頁，原審重勞訴卷(五)第1頁至第168頁，\r\n    原審重勞訴卷(二)第13頁至第43頁，原審重勞訴卷(六)第118頁\r\n    至第166頁）。然審酌上訴人各年度銷售金額起落尚受經濟\r\n    景氣循環或生產結構變化各項因素影響；上開業績金額復未\r\n    扣除成本，自無從逕據為認定上訴人所受損害金額之準據。\r\n  (二)惟按當事人已證明受有損害而不能證明其數額或證明有重大\r\n    困難者，法院應審酌一切情況，依所得心證定其數額，民事\r\n    訴訟法第222條第2項定有明文。經查：\r\n  1.關於上訴人於97 年至100年度之營業淨利依序為2416萬9043\r\n    元、1284萬0726元、2159萬7562元、1371萬7763元乙節，有\r\n    財政部臺灣省北區國稅局桃園縣分局101年10月8日北區國稅\r\n    桃縣一字第1011044236 號函檢送97年至100年度營利事業所\r\n    得稅結算申報書影本為證（原審重勞訴卷(二)第37頁至第45頁\r\n    ）。據上雖未見上訴人於饒瑞鈞、蔡建宏99年離職前後有明\r\n    顯營收金額之變化。此或因整體營收金額受經濟景氣、經營\r\n    策略及市場競爭等諸多因素影響致無從判斷之故。然審酌艾\r\n    美公司於99年6 月14日以前揭不正競爭方式取得友達公司供\r\n    應商資格後，既參與友達公司及其集團供應鏈廠商締約機會\r\n    之競爭，則上訴人主張因此受有客戶流失之損害乙節，本非\r\n    無稽。且經原審依上訴人聲請查詢結果，艾美公司確自99年\r\n    6 月間取得友達公司合格供應商資格後，即陸續與上訴人原\r\n    交易之友達公司及友達體系代工廠客戶原交易品項之導熱介\r\n    面材料進行交易等情，有友達公司102年9月28日民事陳報狀\r\n    檢附附件明細、輔祥實業股份有限公司102年10月1日函附輔\r\n    祥實業股份有限公司及其關係企業輔訊光電（廈門）有限公\r\n    司、輔訊光電（蘇州）有限公司採購明細、景智電子股份有\r\n    限公司102年10月30 日函附達運精密工業（廈門）股份有限\r\n    公司、達運精密工業（蘇州）有限公司交易紀錄、中強光電\r\n    股份有限公司102年11月18 日函附中強光電股份有限公司、\r\n    蘇州璨宇光電有限公司、上海璨宇光電有限公司交易明細、\r\n    州巧科技股份有限公司103年8月5 日陳報狀附交易明細、瑞\r\n    儀光電股份有限公司104年3月27日函附其大陸地區關係企業\r\n    瑞儀光電（蘇州）有限公司交易明細可稽（原審重勞訴卷(三)\r\n    第67頁至第70頁、第79頁至第115 頁、第140頁至第152頁、\r\n    第153頁至第164頁，原審重勞訴卷(六)第58頁至第61頁、第29\r\n    3頁至第300頁）。足認上訴人就其因艾美公司、李維鋐、蔡\r\n    建宏、饒瑞鈞不法侵權行為受有損害乙節，已有證明。\r\n  2.又查艾美公司等前揭不法侵害行為之目的雖在與上訴人競爭\r\n    與友達公司及其供應鏈廠商就導熱介面之締約利益，並致上\r\n    訴人受有客戶流失、交易獲益減少之損害。然因影響兩造交\r\n    易消長之因素尚涉及整體經濟景氣、產業結構發展、同業價\r\n    格競爭、及產品品質良窳等等各項，堪認本件確有損害數額\r\n    難以證明之情形。從而本院審酌兩造對於艾美公司成為友達\r\n    公司供應商後，與上訴人原交易對象包括友達公司及其供應\r\n    鏈廠商間關於導熱介面材料之成交金額乃如後附表所示乙節\r\n    ，已無爭執（本院卷(三)第45 頁、第46頁、第70頁、156頁至\r\n    第159頁、第160頁、第204 頁）。並以上開金額按財政部稅\r\n    務行業標準分類暨同業利潤標準分類編號1841-11 合成樹脂\r\n    製造業之淨利率16％（附於本院卷(一)第167 頁）計算結果，\r\n    其淨利計算雖達到2161萬1532元之數（兩造所不爭執卷內附\r\n    表所列東貝公司係屬冠捷集團，故其成交金額已予剔除）。\r\n    惟上開表列成交金額實尚包括少數導熱膠帶、導熱矽膠以外\r\n    之其他導熱介面材料之交易乙節，有友達公司及友達體系代\r\n    工廠客戶前揭函附交易明細可稽（原審重勞訴卷(三)第67頁至\r\n    第70頁、第79頁至第115頁、第140頁至第152頁、第153頁至\r\n    第164頁，原審重勞訴卷(六)第58頁至第61頁、第293頁至第30\r\n    0頁）。併考量上訴人於艾美公司成為友達公司供應商前之9\r\n    7年、98年度之營業淨利僅有2416萬9043元、1284萬0726 元\r\n    乙節，有財政部臺灣省北區國稅局桃園縣分局101年10月8日\r\n    北區國稅桃縣一字第1011044236號函檢送營利事業所得稅結\r\n    算申報書影本為憑（原審重勞訴卷(二)第37頁至第41頁）；且\r\n    其中尚涵括上訴人與友達集團以外諸如冠捷集團等之交易獲\r\n    利在內乙節；復參酌其他一切可能影響營收之各項因素。爰\r\n    定上訴人所受損害金額為450 萬元。上訴人逾此部分之請求\r\n    ，則不能准許。\r\n六、綜上所述，上訴人依侵權行為等規定，請求艾美公司、李維\r\n    鋐、蔡建宏、饒瑞鈞應連帶給付上訴人450 萬元，及自起訴\r\n    狀繕本送達之翌日即艾美公司及李維鋐自101年4月11日起，\r\n    蔡建宏、饒瑞鈞自101年4月24日起（送達證書附於原審司北\r\n    勞調卷第200頁至第203 頁），均至清償日止，按週年利率5\r\n    ％計算之利息部分，為有理由，應予准許；逾此部分之請求\r\n    ，為無理由，不應准許。從而原審就上開應准許部分，為上\r\n    訴人敗訴之判決，尚有未洽，上訴論旨指摘原判決此部分不\r\n    當，求予廢棄改判，為有理由，爰由本院廢棄改判如主文第\r\n    二項所示。至於上訴人之請求不應准許部分（確定部分除外\r\n    ），原審為上訴人敗訴之判決，並駁回其假執行之聲請，經\r\n    核並無不合，上訴意旨指摘原判決此部分不當，求予廢棄改\r\n    判，為無理由，應駁回此部分之上訴。又上訴人勝訴部分，\r\n    兩造均陳明願供擔保宣告准免假執行，經核均無不合，爰分\r\n    別酌定相當擔保金額准許之。\r\n七、本件事證已臻明確，兩造其餘之攻擊或防禦方法及所用之證\r\n    據，經本院斟酌後，認為均不足以影響本判決之結果，爰不\r\n    逐一論列，附此敘明。\r\n八、據上論結，本件上訴為一部有理由、一部無理由，依民事訴\r\n    訟法第450條、第449條第1項、第79條、第85條第2項、第46\r\n    3條、第390條第2項、第392條第2項，判決如主文。\r\n中    華    民    國   107    年    12    月    12    日\r\n                     勞工法庭  \r\n                         審判長法  官   李瑜娟\r\n                               法  官   邱景芬\r\n                               法  官   沈佳宜\r\n以上正本係照原本作成\r\n如不服本判決，應於收受送達後20日內向本院提出上訴書狀，其\r\n未表明上訴理由者，應於提出上訴後20日內向本院補提理由書狀\r\n（均須按他造當事人之人數附繕本）上訴時應提出委任律師或具\r\n有律師資格之人之委任狀；委任有律師資格者，另應附具律師及\r\n格證書及釋明委任人與受任人有民事訴訟第466條之1第1 項但書\r\n或第2項（詳附註）所定關係之釋明文書影本。如委任律師提\r\n起上訴者，應一併繳納上\r\n中    華    民    國   107    年    12    月    12    日\r\n                               書記官   潘大鵬\r\n附註：\r\n民事訴訟法第466 條之1 （第1 項、第2 項）：\r\n對於第二審判決上訴，上訴人應委任律師為訴訟代理人。但上訴\r\n人或其法定代理人具有律師資格者，不在此限。\r\n上訴人之配偶、三親等內之血親、二親等內之姻親，或上訴人為\r\n法人、中央或地方機關時，其所屬專任人員具有律師資格並經法\r\n院認為適當者，亦得為第三審訴訟代理人。\r\n※附表(略)","type":"判決","historyHash":"5d6a31f2cde13bb1287810ec","mainText":"原判決關於駁回上訴人後開第二項之訴部分，及該部分假執行之聲請，暨訴訟費用（確定部分除外）之裁判均廢棄。\n被上訴人艾美材料科技有限公司、李維鋐、蔡建宏、饒瑞鈞應連帶給付上訴人新臺幣肆佰伍拾萬元，及艾美材料科技有限公司、李維鋐自民國一０一年四月十一日起，蔡建宏、饒瑞鈞自民國一０一年四月二十四日起，均至清償日止，按週年利率百分之五計算之利息。\n其餘上訴駁回。\n第一審（確定部分除外）、第二審訴訟費用，由被上訴人艾美材料科技有限公司、李維鋐、蔡建宏、饒瑞鈞連帶負擔百分之七，餘由上訴人負擔。\n本判決所命給付部分，於上訴人以新臺幣壹佰伍拾萬元供擔保後得假執行，但被上訴人艾美材料科技有限公司、李維鋐、蔡建宏、饒瑞鈞如以新臺幣肆佰伍拾萬元或同額之國泰世華商業銀行西松分行可轉讓定期存單預供擔保，得免為假執行。","opinion":"(二)惟按當事人已證明受有損害而不能證明其數額或證明有重大困難者，法院應審酌一切情況，依所得心證定其數額，民事訴訟法第222條第2項定有明文。經查：\n  1.關於上訴人於97 年至100年度之營業淨利依序為2416萬9043元、1284萬0726元、2159萬7562元、1371萬7763元乙節，有財政部臺灣省北區國稅局桃園縣分局101年10月8日北區國稅桃縣一字第1011044236 號函檢送97年至100年度營利事業所得稅結算申報書影本為證（原審重勞訴卷(二)第37頁至第45頁）。據上雖未見上訴人於饒瑞鈞、蔡建宏99年離職前後有明顯營收金額之變化。此或因整體營收金額受經濟景氣、經營策略及市場競爭等諸多因素影響致無從判斷之故。然審酌艾美公司於99年6 月14日以前揭不正競爭方式取得友達公司供應商資格後，既參與友達公司及其集團供應鏈廠商締約機會之競爭，則上訴人主張因此受有客戶流失之損害乙節，本非無稽。且經原審依上訴人聲請查詢結果，艾美公司確自99年6 月間取得友達公司合格供應商資格後，即陸續與上訴人原交易之友達公司及友達體系代工廠客戶原交易品項之導熱介面材料進行交易等情，有友達公司102年9月28日民事陳報狀檢附附件明細、輔祥實業股份有限公司102年10月1日函附輔祥實業股份有限公司及其關係企業輔訊光電（廈門）有限公司、輔訊光電（蘇州）有限公司採購明細、景智電子股份有限公司102年10月30 日函附達運精密工業（廈門）股份有限公司、達運精密工業（蘇州）有限公司交易紀錄、中強光電股份有限公司102年11月18 日函附中強光電股份有限公司、蘇州璨宇光電有限公司、上海璨宇光電有限公司交易明細、州巧科技股份有限公司103年8月5 日陳報狀附交易明細、瑞儀光電股份有限公司104年3月27日函附其大陸地區關係企業瑞儀光電（蘇州）有限公司交易明細可稽（原審重勞訴卷(三)第67頁至第70頁、第79頁至第115 頁、第140頁至第152頁、第153頁至第164頁，原審重勞訴卷(六)第58頁至第61頁、第29 3頁至第300頁）。足認上訴人就其因艾美公司、李維鋐、蔡建宏、饒瑞鈞不法侵權行為受有損害乙節，已有證明。\n  2.又查艾美公司等前揭不法侵害行為之目的雖在與上訴人競爭與友達公司及其供應鏈廠商就導熱介面之締約利益，並致上訴人受有客戶流失、交易獲益減少之損害。然因影響兩造交易消長之因素尚涉及整體經濟景氣、產業結構發展、同業價格競爭、及產品品質良窳等等各項，堪認本件確有損害數額難以證明之情形。從而本院審酌兩造對於艾美公司成為友達公司供應商後，與上訴人原交易對象包括友達公司及其供應鏈廠商間關於導熱介面材料之成交金額乃如後附表所示乙節，已無爭執（本院卷(三)第45 頁、第46頁、第70頁、156頁至第159頁、第160頁、第204 頁）。並以上開金額按財政部稅務行業標準分類暨同業利潤標準分類編號1841-11 合成樹脂製造業之淨利率16％（附於本院卷(一)第167 頁）計算結果，其淨利計算雖達到2161萬1532元之數（兩造所不爭執卷內附表所列東貝公司係屬冠捷集團，故其成交金額已予剔除）。\n    惟上開表列成交金額實尚包括少數導熱膠帶、導熱矽膠以外之其他導熱介面材料之交易乙節，有友達公司及友達體系代工廠客戶前揭函附交易明細可稽（原審重勞訴卷(三)第67頁至第70頁、第79頁至第115頁、第140頁至第152頁、第153頁至第164頁，原審重勞訴卷(六)第58頁至第61頁、第293頁至第30 0頁）。併考量上訴人於艾美公司成為友達公司供應商前之9 7年、98年度之營業淨利僅有2416萬9043元、1284萬0726 元乙節，有財政部臺灣省北區國稅局桃園縣分局101年10月8日北區國稅桃縣一字第1011044236號函檢送營利事業所得稅結算申報書影本為憑（原審重勞訴卷(二)第37頁至第41頁）；且其中尚涵括上訴人與友達集團以外諸如冠捷集團等之交易獲利在內乙節；復參酌其他一切可能影響營收之各項因素。爰定上訴人所受損害金額為450 萬元。上訴人逾此部分之請求，則不能准許。\n六、綜上所述，上訴人依侵權行為等規定，請求艾美公司、李維鋐、蔡建宏、饒瑞鈞應連帶給付上訴人450 萬元，及自起訴狀繕本送達之翌日即艾美公司及李維鋐自101年4月11日起，蔡建宏、饒瑞鈞自101年4月24日起（送達證書附於原審司北勞調卷第200頁至第203 頁），均至清償日止，按週年利率5％計算之利息部分，為有理由，應予准許；逾此部分之請求，為無理由，不應准許。從而原審就上開應准許部分，為上訴人敗訴之判決，尚有未洽，上訴論旨指摘原判決此部分不當，求予廢棄改判，為有理由，爰由本院廢棄改判如主文第二項所示。至於上訴人之請求不應准許部分（確定部分除外），原審為上訴人敗訴之判決，並駁回其假執行之聲請，經核並無不合，上訴意旨指摘原判決此部分不當，求予廢棄改判，為無理由，應駁回此部分之上訴。又上訴人勝訴部分，兩造均陳明願供擔保宣告准免假執行，經核均無不合，爰分別酌定相當擔保金額准許之。\n七、本件事證已臻明確，兩造其餘之攻擊或防禦方法及所用之證據，經本院斟酌後，認為均不足以影響本判決之結果，爰不逐一論列，附此敘明。\n八、據上論結，本件上訴為一部有理由、一部無理由，依民事訴訟法第450條、第449條第1項、第79條、第85條第2項、第46 3條、第390條第2項、第392條第2項，判決如主文。","relatedIssues":[{"lawName":"公司法","issueRef":"8"},{"lawName":"公司法","issueRef":"23 1"},{"lawName":"公司法","issueRef":"29"},{"lawName":"公司法","issueRef":"34"},{"lawName":"公平交易法","issueRef":"21 1"},{"lawName":"民事訴訟法","issueRef":"79"},{"lawName":"民事訴訟法","issueRef":"85 2"},{"lawName":"民事訴訟法","issueRef":"222 2"},{"lawName":"民事訴訟法","issueRef":"390 2"},{"lawName":"民事訴訟法","issueRef":"392 2"},{"lawName":"民事訴訟法","issueRef":"449 1"},{"lawName":"民事訴訟法","issueRef":"450"},{"lawName":"民事訴訟法","issueRef":"463"},{"lawName":"民事訴訟法","issueRef":"466-1"},{"lawName":"民法","issueRef":"28"},{"lawName":"民法","issueRef":"28"},{"lawName":"民法","issueRef":"184"},{"lawName":"民法","issueRef":"184 1"},{"lawName":"民法","issueRef":"184 1"},{"lawName":"民法","issueRef":"185"},{"lawName":"民法","issueRef":"185"},{"lawName":"民法","issueRef":"188"},{"lawName":"民法","issueRef":"188"},{"lawName":"民法","issueRef":"226"},{"lawName":"民法","issueRef":"226"},{"lawName":"民法","issueRef":"227"},{"lawName":"民法","issueRef":"227"}],"party":[{"group":["plaintiff"],"title":"上訴人","value":"高柏科技有限公司"},{"group":[],"title":"法定代理人","value":"蕭酩献"},{"group":["plaintiff","agentAdLitem"],"title":"訴訟代理人","value":"黃淑敏"},{"group":["plaintiff","agentAdLitem"],"title":"訴訟代理人","value":"蕭瑟芬"},{"group":["plaintiff","agentAdLitem","lawyer"],"title":"訴訟代理人","value":"黃立心律師"},{"group":["plaintiff","agentAdLitem","lawyer"],"title":"訴訟代理人","value":"蔡岳龍律師"},{"group":["plaintiff","agentAdLitem","lawyer"],"title":"訴訟代理人","value":"陳姵君律師"},{"group":["plaintiff","agentAdLitem","lawyer"],"title":"上一人複代理人","value":"柯晨晧律師"},{"group":["plaintiff","agentAdLitem","lawyer"],"title":"上一人複代理人","value":"陳瑞斌律師"},{"group":["defendant"],"title":"被上訴人","value":"艾美材料科技有限公司"},{"group":[],"title":"法定代理人","value":"饒瑞祥"},{"group":["defendant","agentAdLitem","lawyer"],"title":"訴訟代理人","value":"張寧洲律師"},{"group":["defendant"],"title":"被上訴人","value":"李維鋐"},{"group":["defendant"],"title":"被上訴人","value":"蔡建宏"},{"group":["defendant"],"title":"被上訴人","value":"饒瑞鈞"},{"group":["defendant"],"title":"被上訴人","value":"王苡倫"},{"group":["defendant","agentAdLitem","lawyer"],"title":"上五人共同訴訟代理人","value":"蔡調彰律師"}]}
